,Thời gian,Tiêu đề,URL
0,(14/11/2025 00:00),TCB: Nghị quyết HĐQT về ký Hợp đồng đại lý bảo hiểm giữa TCB-TCLife,https://cafef.vn/du-lieu/TCB-2340735/tcb-nghi-quyet-hdqt-ve-ky-hop-dong-dai-ly-bao-hiem-giua-tcbtclife.chn?utm_source=du-lieu
1,(10/11/2025 00:00),TCB: HĐQT phê duyệt cấp thẻ tín dụng cho Ông DANNY LE là người có liên quan,https://cafef.vn/du-lieu/TCB-2336780/tcb-hdqt-phe-duyet-cap-the-tin-dung-cho-ong-danny-le-la-nguoi-co-lien-quan.chn?utm_source=du-lieu
2,(07/11/2025 00:00),"TCB: 5.8.2026, giao dịch 21.388.675 cp niêm yết bổ sung",https://cafef.vn/du-lieu/TCB-2336134/tcb-582026-giao-dich-21388675-cp-niem-yet-bo-sung.chn?utm_source=du-lieu
3,(04/11/2025 00:00),TCB: Bà Nguyễn Thu Lan - Phó Chủ tịch HĐQT đã mua 800.000 cp,https://cafef.vn/du-lieu/TCB-2334532/tcb-ba-nguyen-thu-lan-pho-chu-tich-hdqt-da-mua-800000-cp.chn?utm_source=du-lieu
4,(31/10/2025 00:00),"TCB: 4.11.2025, niêm yết bổ sung 21.388.675 cp",https://cafef.vn/du-lieu/TCB-2333187/tcb-4112025-niem-yet-bo-sung-21388675-cp.chn?utm_source=du-lieu
5,(29/10/2025 00:00),TCB: Nghị quyết HĐQT về cấp tín dụng cho Công ty TNHH Sản xuất và Thương mại Hoa Sen Vàng,https://cafef.vn/du-lieu/TCB-2332116/tcb-nghi-quyet-hdqt-ve-cap-tin-dung-cho-cong-ty-tnhh-san-xuat-va-thuong-mai-hoa-sen-vang.chn?utm_source=du-lieu
6,(28/10/2025 00:00),TCB: Quyết định của HĐQT về việc thay đổi địa điểm và đổi tên phòng Giao dịch Central Park,https://cafef.vn/du-lieu/TCB-2327560/tcb-quyet-dinh-cua-hdqt-ve-viec-thay-doi-dia-diem-va-doi-ten-phong-giao-dich-central-park.chn?utm_source=du-lieu
7,(24/10/2025 00:00),TCB: Nghị quyết HĐQT phê duyệt giao dịch/ hợp đồng cung cấp dịch vụ đại lý lưu ký cho Trái phiếu TCB phát hành riêng lẻ 2025 - lần 22,https://cafef.vn/du-lieu/TCB-2326162/tcb-nghi-quyet-hdqt-phe-duyet-giao-dich-hop-dong-cung-cap-dich-vu-dai-ly-luu-ky-cho-trai-phieu-tcb-phat-hanh-rieng-le-2025-lan-22.chn?utm_source=du-lieu
8,(24/10/2025 00:00),TCB: Bà Nguyễn Thu Lan - Phó Chủ tịch HĐQT đăng ký mua 800.000 cp,https://cafef.vn/du-lieu/TCB-2326284/tcb-ba-nguyen-thu-lan-pho-chu-tich-hdqt-dang-ky-mua-800000-cp.chn?utm_source=du-lieu
9,(21/10/2025 16:32),"Lợi nhuận 9 tháng đầu năm 2025 của Techcombank cao nhất nhóm ngân hàng tư nhân, tỷ lệ CASA tiếp tục dẫn đầu ngành",https://cafef.vn/loi-nhuan-9-thang-dau-nam-2025-cua-techcombank-cao-nhat-nhom-ngan-hang-tu-nhan-ty-le-casa-tiep-tuc-dan-dau-nganh-188251021163259026.chn?utm_source=du-lieu
10,(20/10/2025 16:38),"Nếu một ngày tài khoản chứng khoán giảm cả tỷ đồng, đừng buồn vì có những người đã mất hàng nghìn, chục nghìn tỷ",https://cafef.vn/neu-mot-ngay-tai-khoan-chung-khoan-giam-ca-ty-dong-dung-buon-vi-co-nhung-nguoi-da-mat-hang-nghin-chuc-nghin-ty-188251020163817401.chn?utm_source=du-lieu
11,(20/10/2025 00:00),TCB: Nghị quyết HĐQT về việc TCBS tư vấn phát hành trái phiếu lần 21.2025,https://cafef.vn/du-lieu/TCB-2320640/tcb-nghi-quyet-hdqt-ve-viec-tcbs-tu-van-phat-hanh-trai-phieu-lan-212025.chn?utm_source=du-lieu
12,(15/10/2025 00:00),TCB: Nghị quyết HĐQT về việc TCBS tư vấn phát hành trái phiếu TCB năm 2025 lần 20,https://cafef.vn/du-lieu/TCB-2317579/tcb-nghi-quyet-hdqt-ve-viec-tcbs-tu-van-phat-hanh-trai-phieu-tcb-nam-2025-lan-20.chn?utm_source=du-lieu
13,(15/10/2025 00:00),TCB: Thông báo quyết định của NHNN về việc sửa đổi nội dung vốn điều lệ tại Giấy phép thành lập và hoạt động của TCB,https://cafef.vn/du-lieu/TCB-2317580/tcb-thong-bao-quyet-dinh-cua-nhnn-ve-viec-sua-doi-noi-dung-von-dieu-le-tai-giay-phep-thanh-lap-va-hoat-dong-cua-tcb.chn?utm_source=du-lieu
14,(09/10/2025 00:00),TCB: Nghị quyết HĐQT về việc TCBS tư vấn phát hành trái phiếu TCB năm 2025 lần 19,https://cafef.vn/du-lieu/TCB-2313575/tcb-nghi-quyet-hdqt-ve-viec-tcbs-tu-van-phat-hanh-trai-phieu-tcb-nam-2025-lan-19.chn?utm_source=du-lieu
15,(07/10/2025 07:52),"'Đế chế' của ông Phạm Nhật Vượng chỉ có 37,3% nhân sự nữ nhưng các nữ tướng chiếm 59%, ngân hàng là 'thánh địa' của giới nữ ngoại trừ Sacombank",https://cafef.vn/de-che-cua-ong-pham-nhat-vuong-chi-co-373-nhan-su-nu-nhung-cac-nu-tuong-chiem-59-ngan-hang-la-thanh-dia-cua-gioi-nu-ngoai-tru-sacombank-188251007075236181.chn?utm_source=du-lieu
16,(07/10/2025 00:00),TCB: Quyết định của HĐQT về việc thay đổi địa điểm PGD Yên Phong,https://cafef.vn/du-lieu/TCB-2311852/tcb-quyet-dinh-cua-hdqt-ve-viec-thay-doi-dia-diem-pgd-yen-phong.chn?utm_source=du-lieu
17,(30/09/2025 00:00),TCB: Nghị quyết HĐQT phê duyệt hạn mức tín dụng cho Công ty TNHH Đầu tư BĐS Eurowindow Light City,https://cafef.vn/du-lieu/TCB-2307521/tcb-nghi-quyet-hdqt-phe-duyet-han-muc-tin-dung-cho-cong-ty-tnhh-dau-tu-bds-eurowindow-light-city.chn?utm_source=du-lieu
18,(30/09/2025 00:00),TCB: Quyết định của HĐQT về việc thay đổi địa chỉ phòng GD Phan Xích Long,https://cafef.vn/du-lieu/TCB-2307606/tcb-quyet-dinh-cua-hdqt-ve-viec-thay-doi-dia-chi-phong-gd-phan-xich-long.chn?utm_source=du-lieu
19,(30/09/2025 00:00),TCB: Nghị quyết HĐQT về việc ký hợp đồng mau thẻ nạp Upoint do OMC cung cấp,https://cafef.vn/du-lieu/TCB-2307668/tcb-nghi-quyet-hdqt-ve-viec-ky-hop-dong-mau-the-nap-upoint-do-omc-cung-cap.chn?utm_source=du-lieu
20,(29/09/2025 00:00),TCB: Nghị quyết HĐQT về việc cho Techcom Life mượn trụ sở làm Văn phòng tại Trần Duy Hưng,https://cafef.vn/du-lieu/TCB-2307292/tcb-nghi-quyet-hdqt-ve-viec-cho-techcom-life-muon-tru-so-lam-van-phong-tai-tran-duy-hung.chn?utm_source=du-lieu
21,(25/09/2025 00:00),TCB: Nghị quyết HĐQT về việc ký kết thỏa thuận hợp tác toàn điện giữa TCB và Techcom Life,https://cafef.vn/du-lieu/TCB-2303606/tcb-nghi-quyet-hdqt-ve-viec-ky-ket-thoa-thuan-hop-tac-toan-dien-giua-tcb-va-techcom-life.chn?utm_source=du-lieu
22,(25/09/2025 00:00),TCB: Nghị quyết HĐQT về việc cấp mới hạn mức PSE cho TCBS,https://cafef.vn/du-lieu/TCB-2303607/tcb-nghi-quyet-hdqt-ve-viec-cap-moi-han-muc-pse-cho-tcbs.chn?utm_source=du-lieu
23,(25/09/2025 00:00),TCB: Nghị quyết HĐQT về việc TCBS tư vấn phát hành trái phiếu TCB năm 2025 lần 17,https://cafef.vn/du-lieu/TCB-2304172/tcb-nghi-quyet-hdqt-ve-viec-tcbs-tu-van-phat-hanh-trai-phieu-tcb-nam-2025-lan-17.chn?utm_source=du-lieu
24,(25/09/2025 00:00),TCB: Nghị quyết HĐQT về việc TCBS tư vấn phát hành trái phiếu TCB năm 2025 lần 18,https://cafef.vn/du-lieu/TCB-2304189/tcb-nghi-quyet-hdqt-ve-viec-tcbs-tu-van-phat-hanh-trai-phieu-tcb-nam-2025-lan-18.chn?utm_source=du-lieu
25,(24/09/2025 00:00),"TCB: 30.9.2025, ngày GDKHQ chi trả cổ tức năm 2024 bằng tiền (1.000 đ/cp)",https://cafef.vn/du-lieu/TCB-2303484/tcb-3092025-ngay-gdkhq-chi-tra-co-tuc-nam-2024-bang-tien-1000-dcp.chn?utm_source=du-lieu
26,(18/09/2025 00:00),TCB: Ông Phạm Quang Thắng - Phó Tổng GĐ đã bán 520.000 cp,https://cafef.vn/du-lieu/TCB-2299365/tcb-ong-pham-quang-thang-pho-tong-gd-da-ban-520000-cp.chn?utm_source=du-lieu
27,(17/09/2025 00:00),TCB: Quyết định của HĐQT về việc thành lập Chi nhánh Trảng Bom,https://cafef.vn/du-lieu/TCB-2298598/tcb-quyet-dinh-cua-hdqt-ve-viec-thanh-lap-chi-nhanh-trang-bom.chn?utm_source=du-lieu
28,(17/09/2025 00:00),TCB: Quyết định của HĐQT về việc thành lập Chi nhánh Việt Yên,https://cafef.vn/du-lieu/TCB-2298599/tcb-quyet-dinh-cua-hdqt-ve-viec-thanh-lap-chi-nhanh-viet-yen.chn?utm_source=du-lieu
29,(17/09/2025 00:00),TCB: Quyết định của HĐQT về việc thay đổi địa điểm Chi nhánh Nghệ An,https://cafef.vn/du-lieu/TCB-2298638/tcb-quyet-dinh-cua-hdqt-ve-viec-thay-doi-dia-diem-chi-nhanh-nghe-an.chn?utm_source=du-lieu
30,(16/09/2025 00:00),TCB: Nghị quyết HĐQT về việc triển khai phương án chi trả cổ tức năm 2024 bằng tiền,https://cafef.vn/du-lieu/TCB-2298001/tcb-nghi-quyet-hdqt-ve-viec-trien-khai-phuong-an-chi-tra-co-tuc-nam-2024-bang-tien.chn?utm_source=du-lieu
31,(15/09/2025 16:56),Techcombank chuẩn bị trả cổ tức bằng tiền mặt,https://cafef.vn/techcombank-chuan-bi-tra-co-tuc-bang-tien-mat-188250915165648313.chn?utm_source=du-lieu
32,(15/09/2025 00:00),"TCB: Quyết định của HĐQT về việc thay đổi chi nhánh quản lý, địa điểm và tên của Phòng GD Nguyễn Chí Thanh",https://cafef.vn/du-lieu/TCB-2296400/tcb-quyet-dinh-cua-hdqt-ve-viec-thay-doi-chi-nhanh-quan-ly-dia-diem-va-ten-cua-phong-gd-nguyen-chi-thanh.chn?utm_source=du-lieu
33,(15/09/2025 00:00),TCB: Quyết định của HĐQT về việc thay đổi địa điểm và tên phòng GD Nguyễn Oanh,https://cafef.vn/du-lieu/TCB-2296403/tcb-quyet-dinh-cua-hdqt-ve-viec-thay-doi-dia-diem-va-ten-phong-gd-nguyen-oanh.chn?utm_source=du-lieu
34,(12/09/2025 15:23),Techcombank đồng hành cùng SMEs hoàn thiện hệ thống phúc lợi và giữ chân nhân tài,https://cafef.vn/techcombank-dong-hanh-cung-smes-hoan-thien-he-thong-phuc-loi-va-giu-chan-nhan-tai-18825091215241049.chn?utm_source=du-lieu
35,(12/09/2025 08:11),"Sản phẩm Techcombank Sinh Lời Tự Động giành giải vàng Stevie Awards - ""Oscar"" trong lĩnh vực kinh doanh quốc tế",https://cafef.vn/san-pham-techcombank-sinh-loi-tu-dong-gianh-giai-vang-stevie-awards-oscar-trong-linh-vuc-kinh-doanh-quoc-te-188250916101159515.chn?utm_source=du-lieu
36,(11/09/2025 00:00),TCB: Nghị quyết HĐQT về việc phê duyệt cấp tín dụng cho Công ty Cổ phần Eurowindow,https://cafef.vn/du-lieu/TCB-2294529/tcb-nghi-quyet-hdqt-ve-viec-phe-duyet-cap-tin-dung-cho-cong-ty-co-phan-eurowindow.chn?utm_source=du-lieu
37,(11/09/2025 00:00),TCB: Nghị quyết HĐQT về giao dịch phi tín dụng TCB và Công ty con TCB,https://cafef.vn/du-lieu/TCB-2294531/tcb-nghi-quyet-hdqt-ve-giao-dich-phi-tin-dung-tcb-va-cong-ty-con-tcb.chn?utm_source=du-lieu
38,(08/09/2025 08:03),"Rục rịch đưa ""Gà đẻ trứng vàng"" lên sàn, cổ phiếu loạt doanh nghiệp Việt tăng ""bốc đầu""",https://cafef.vn/ruc-rich-dua-ga-de-trung-vang-len-san-co-phieu-loat-doanh-nghiep-viet-tang-boc-dau-188250908080519123.chn?utm_source=du-lieu
39,(30/08/2025 13:26),"Techcombank chính thức kết nối với ứng dụng VNeID, hỗ trợ khách hàng nhận tiền an sinh xã hội an toàn và tiện lợi",https://cafef.vn/techcombank-chinh-thuc-ket-noi-voi-ung-dung-vneid-ho-tro-khach-hang-nhan-tien-an-sinh-xa-hoi-an-toan-va-tien-loi-188250830132651567.chn?utm_source=du-lieu
40,(28/08/2025 20:11),"Techcombank ghi dấu ấn tại ""Triển lãm thành tựu đất nước""",https://cafef.vn/techcombank-ghi-dau-an-tai-trien-lam-thanh-tuu-dat-nuoc-188250828201140032.chn?utm_source=du-lieu
41,(28/08/2025 00:00),TCB: Thông báo công văn của VSDC về việc điều chỉnh tỷ lệ SHNN tối đa của TCB,https://cafef.vn/du-lieu/TCB-2288139/tcb-thong-bao-cong-van-cua-vsdc-ve-viec-dieu-chinh-ty-le-shnn-toi-da-cua-tcb.chn?utm_source=du-lieu
42,(27/08/2025 17:43),Những sự kiện mà “khối yêu nước” không nên bỏ lỡ khi đến với Hà Nội nhân dịp đại lễ 80 năm!,https://cafef.vn/nhung-su-kien-ma-khoi-yeu-nuoc-khong-nen-bo-lo-khi-den-voi-ha-noi-nhan-dip-dai-le-80-nam-188250827174403149.chn?utm_source=du-lieu
43,(27/08/2025 11:53),Techcombank nhận bằng khen của Thủ tướng vì đóng góp tích cực trong chương trình an sinh trọng điểm của Quốc gia,https://cafef.vn/techcombank-nhan-bang-khen-cua-thu-tuong-vi-dong-gop-tich-cuc-trong-chuong-trinh-an-sinh-trong-diem-cua-quoc-gia-188250827115429326.chn?utm_source=du-lieu
44,(26/08/2025 10:36),S&P nâng xếp hạng tín nhiệm của Techcombank lên mức BB,https://cafef.vn/sp-nang-xep-hang-tin-nhiem-cua-techcombank-len-muc-bb-18825082610365163.chn?utm_source=du-lieu
45,(22/08/2025 00:02),Công ty đứng sau sản phẩm sinh lời tự động mới của Techcombank,https://cafef.vn/cong-ty-dung-sau-san-pham-sinh-loi-tu-dong-moi-cua-techcombank-188250821232251231.chn?utm_source=du-lieu
46,(20/08/2025 00:05),Lần đầu tiên trong lịch sử Việt Nam có 10 ngân hàng vốn hóa trên 100.000 tỷ,https://cafef.vn/lan-dau-tien-trong-lich-su-viet-nam-co-10-ngan-hang-von-hoa-tren-100000-ty-188250819225033748.chn?utm_source=du-lieu
47,(19/08/2025 10:30),Techcombank đồng hành cùng chuỗi sự kiện đặc biệt kỷ niệm 80 năm Cách mạng Tháng Tám và Quốc khánh 2/9,https://cafef.vn/techcombank-dong-hanh-cung-chuoi-su-kien-dac-biet-ky-niem-80-nam-cach-mang-thang-tam-va-quoc-khanh-29-188250819103037551.chn?utm_source=du-lieu
48,(18/08/2025 08:08),"Công bố 100 doanh nghiệp tư nhân nộp ngân sách lớn nhất Việt Nam: Tổng nộp 244.400 tỷ đồng, 48 đơn vị nộp trên nghìn tỷ",https://cafef.vn/cong-bo-100-doanh-nghiep-tu-nhan-nop-ngan-sach-lon-nhat-viet-nam-tong-nop-244400-ty-dong-48-don-vi-nop-tren-nghin-ty-188250817184036191.chn?utm_source=du-lieu
49,(18/08/2025 00:00),TCB: Ông Phạm Quang Thắng - Phó Tổng GĐ đăng ký bán 600.000 cp,https://cafef.vn/du-lieu/TCB-2277532/tcb-ong-pham-quang-thang-pho-tong-gd-dang-ky-ban-600000-cp.chn?utm_source=du-lieu
50,(12/08/2025 00:00),TCB: Nghị quyết HĐQT thông qua hợp đồng giao dịch thuộc nghiệp vụ phi tín dụng giữa TCB và CTCP Tập đoàn Masan,https://cafef.vn/du-lieu/TCB-2269593/tcb-nghi-quyet-hdqt-thong-qua-hop-dong-giao-dich-thuoc-nghiep-vu-phi-tin-dung-giua-tcb-va-ctcp-tap-doan-masan.chn?utm_source=du-lieu
51,(12/08/2025 00:00),TCB: Nghị quyết HĐQT thông qua hợp đồng giao dịch thuộc nghiệp vụ phi tín dụng giữa TCB và ông Jens Lottner,https://cafef.vn/du-lieu/TCB-2269595/tcb-nghi-quyet-hdqt-thong-qua-hop-dong-giao-dich-thuoc-nghiep-vu-phi-tin-dung-giua-tcb-va-ong-jens-lottner.chn?utm_source=du-lieu
52,(12/08/2025 00:00),TCB: Thông báo thay đổi nhân sự,https://cafef.vn/du-lieu/TCB-2269665/tcb-thong-bao-thay-doi-nhan-su.chn?utm_source=du-lieu
53,(11/08/2025 16:09),Tiến sỹ Jens Lottner tiếp tục làm Tổng giám đốc Techcombank trong giai đoạn 2025-2030,https://cafef.vn/tien-sy-jens-lottner-tiep-tuc-lam-tong-giam-doc-techcombank-trong-giai-doan-20252030-188250811160920849.chn?utm_source=du-lieu
54,(11/08/2025 00:00),TCB: Quyết định của HĐQT tái bổ nhiệm ông Jens Lottner giữ chức Tổng Giám đốc nhiệm kỳ 2025-2030,https://cafef.vn/du-lieu/TCB-2269490/tcb-quyet-dinh-cua-hdqt-tai-bo-nhiem-ong-jens-lottner-giu-chuc-tong-giam-doc-nhiem-ky-20252030.chn?utm_source=du-lieu
55,(07/08/2025 00:00),TCB: Số lượng cổ phiếu có quyền biểu quyết đang lưu hành là 7.086.240.414 cp,https://cafef.vn/du-lieu/TCB-2268478/tcb-so-luong-co-phieu-co-quyen-bieu-quyet-dang-luu-hanh-la-7086240414-cp.chn?utm_source=du-lieu
56,(07/08/2025 00:00),TCB: Đã phát hành 21.388.675 cổ phiếu ESOP,https://cafef.vn/du-lieu/TCB-2333184/tcb-da-phat-hanh-21388675-co-phieu-esop.chn?utm_source=du-lieu
57,(05/08/2025 16:55),Techcombank cam kết cơ hội làm việc và tạo điều kiện để nhân tài trở thành “triệu phú USD dưới 30 tuổi”,https://cafef.vn/techcombank-cam-ket-co-hoi-lam-viec-va-tao-dieu-kien-de-nhan-tai-tro-thanh-trieu-phu-usd-duoi-30-tuoi-18825080516562052.chn?utm_source=du-lieu
58,(05/08/2025 11:31),Cổ phiếu của các tỷ phú USD Việt Nam đồng loạt có 'biến',https://cafef.vn/co-phieu-cua-cac-ty-phu-usd-viet-nam-dong-loat-co-bien-188250805113148746.chn?utm_source=du-lieu
59,(05/08/2025 08:00),"Rời FMCG để đầu quân về Techcombank, CMO người Việt Nam duy nhất lọt vào danh sách Top 50 CMOs APAC Power List - 2 năm liên tiếp",https://cafef.vn/roi-fmcg-de-dau-quan-ve-techcombank-cmo-nguoi-viet-nam-duy-nhat-lot-vao-danh-sach-top-50-cmos-apac-power-list-2-nam-lien-tiep-188250804211807972.chn?utm_source=du-lieu
60,(05/08/2025 00:00),TCB: Nghị quyết HĐQT về việc phê duyệt giao dịch PSE cho MSN,https://cafef.vn/du-lieu/TCB-2268371/tcb-nghi-quyet-hdqt-ve-viec-phe-duyet-giao-dich-pse-cho-msn.chn?utm_source=du-lieu
61,(05/08/2025 00:00),TCB: Nghị quyết HĐQT về việc phê duyệt giao dịch PSE cho The Sherpa,https://cafef.vn/du-lieu/TCB-2268372/tcb-nghi-quyet-hdqt-ve-viec-phe-duyet-giao-dich-pse-cho-the-sherpa.chn?utm_source=du-lieu
62,(04/08/2025 00:00),TCB: Nghị quyết HĐQT về việc phê duyệt cấp hạn mức tín dụng cho NPM và MTC,https://cafef.vn/du-lieu/TCB-2267840/tcb-nghi-quyet-hdqt-ve-viec-phe-duyet-cap-han-muc-tin-dung-cho-npm-va-mtc.chn?utm_source=du-lieu
63,(04/08/2025 00:00),TCB: Nghị quyết HĐQT về việc cấp bảo lãnh cho Masan Brewery HG,https://cafef.vn/du-lieu/TCB-2267842/tcb-nghi-quyet-hdqt-ve-viec-cap-bao-lanh-cho-masan-brewery-hg.chn?utm_source=du-lieu
64,(04/08/2025 00:00),TCB: Nghị quyết HĐQT về việc cấp bảo lãnh cho CTCP Hàng tiêu dùng Masan,https://cafef.vn/du-lieu/TCB-2267843/tcb-nghi-quyet-hdqt-ve-viec-cap-bao-lanh-cho-ctcp-hang-tieu-dung-masan.chn?utm_source=du-lieu
65,(02/08/2025 09:13),"20 doanh nghiệp niêm yết lãi lớn nhất 6T2025: 60% là ngân hàng, 15% là bất động sản, chỉ có 1 DN sản xuất",https://cafef.vn/20-doanh-nghiep-niem-yet-lai-lon-nhat-6t2025-60-la-ngan-hang-15-la-bat-dong-san-chi-co-1-dn-san-xuat-188250802085619235.chn?utm_source=du-lieu
66,(01/08/2025 08:00),"Techcombank - One Mount luân chuyển lãnh đạo, tối ưu sức mạnh hệ sinh thái",https://cafef.vn/techcombank-one-mount-luan-chuyen-lanh-dao-toi-uu-suc-manh-he-sinh-thai-188250731225418087.chn?utm_source=du-lieu
67,(01/08/2025 00:00),TCB: Nghị quyết HĐQT về việc xử lý cổ phiếu chưa phân phối hết,https://cafef.vn/du-lieu/TCB-2267481/tcb-nghi-quyet-hdqt-ve-viec-xu-ly-co-phieu-chua-phan-phoi-het.chn?utm_source=du-lieu
68,(31/07/2025 17:55),TCB: Quyết định của HĐQT về việc thay đổi địa điểm phòng GD Lê Hồng Phong,https://cafef.vn/du-lieu/TCB-2260145/tcb-quyet-dinh-cua-hdqt-ve-viec-thay-doi-dia-diem-phong-gd-le-hong-phong.chn?utm_source=du-lieu
69,(30/07/2025 12:07),"Techcombank tham gia mảng bảo hiểm nhân thọ, liệu ""ông lớn"" ngành ngân hàng có tạo nên những khác biệt như Zero Fee hay Sinh Lời Tự Động?",https://cafef.vn/techcombank-tham-gia-mang-bao-hiem-nhan-tho-lieu-ong-lon-nganh-ngan-hang-co-tao-nen-nhung-khac-biet-nhu-zero-fee-hay-sinh-loi-tu-dong-188250730120805588.chn?utm_source=du-lieu
70,(30/07/2025 11:56),"Techcombank được vinh danh ""Ngân hàng bán lẻ nội địa tốt nhất Việt Nam 2025"" năm thứ 4 liên tiếp",https://cafef.vn/techcombank-duoc-vinh-danh-ngan-hang-ban-le-noi-dia-tot-nhat-viet-nam-2025-nam-thu-4-lien-tiep-188250730115611473.chn?utm_source=du-lieu
71,(30/07/2025 00:00),TCB: Ông Alexandre Charles Emmanuel Macaire - Giám đốc Tài chính đã mua 682.109 cp,https://cafef.vn/du-lieu/TCB-2265206/tcb-ong-alexandre-charles-emmanuel-macaire-giam-doc-tai-chinh-da-mua-682109-cp.chn?utm_source=du-lieu
72,(30/07/2025 00:00),TCB: Bà Nguyễn Thị Trà My - Kế toán trưởng đã mua 21.008 cp,https://cafef.vn/du-lieu/TCB-2265218/tcb-ba-nguyen-thi-tra-my-ke-toan-truong-da-mua-21008-cp.chn?utm_source=du-lieu
73,(30/07/2025 00:00),TCB: Bà Nguyễn Thu Lan - Phó Chủ tịch HĐQT đã mua 362.023 cp,https://cafef.vn/du-lieu/TCB-2265220/tcb-ba-nguyen-thu-lan-pho-chu-tich-hdqt-da-mua-362023-cp.chn?utm_source=du-lieu
74,(30/07/2025 00:00),TCB: Ông Nguyễn Tuấn Minh - Phụ trách quản trị đã mua 152.987 cp,https://cafef.vn/du-lieu/TCB-2265221/tcb-ong-nguyen-tuan-minh-phu-trach-quan-tri-da-mua-152987-cp.chn?utm_source=du-lieu
75,(30/07/2025 00:00),TCB: Em rể ông Hoàng Huy Trung - Trưởng BKS đã mua 30.348 cp,https://cafef.vn/du-lieu/TCB-2265223/tcb-em-re-ong-hoang-huy-trung-truong-bks-da-mua-30348-cp.chn?utm_source=du-lieu
76,(30/07/2025 00:00),TCB: Ông Phạm Quang Thắng - Phó Tổng GĐ đã mua 387.239 cp,https://cafef.vn/du-lieu/TCB-2265226/tcb-ong-pham-quang-thang-pho-tong-gd-da-mua-387239-cp.chn?utm_source=du-lieu
77,(30/07/2025 00:00),TCB: Ông Phùng Quang Hưng - Phó Tổng GĐ thường trực đã mua 975.540 cp,https://cafef.vn/du-lieu/TCB-2265242/tcb-ong-phung-quang-hung-pho-tong-gd-thuong-truc-da-mua-975540-cp.chn?utm_source=du-lieu
78,(30/07/2025 00:00),TCB: Nghị quyết HĐQT về việc gioa dịch phi tín dụng với TCLife,https://cafef.vn/du-lieu/TCB-2265390/tcb-nghi-quyet-hdqt-ve-viec-gioa-dich-phi-tin-dung-voi-tclife.chn?utm_source=du-lieu
79,(30/07/2025 00:00),TCB: Nghị quyết HĐQT về việc ký hợp đồng giao dịch với OM,https://cafef.vn/du-lieu/TCB-2265391/tcb-nghi-quyet-hdqt-ve-viec-ky-hop-dong-giao-dich-voi-om.chn?utm_source=du-lieu
80,(29/07/2025 17:50),Techcombank miễn nhiệm Phó Tổng giám đốc Thường trực,https://cafef.vn/techcombank-mien-nhiem-pho-tong-giam-doc-thuong-truc-188250729175050594.chn?utm_source=du-lieu
81,(29/07/2025 09:24),Chứng khoán lập kỷ lục: Những nhà đầu tư Gen Z giàu nhất thị trường là ai?,https://cafef.vn/chung-khoan-lap-ky-luc-nhung-nha-dau-tu-gen-z-giau-nhat-thi-truong-la-ai-188250729092431785.chn?utm_source=du-lieu
82,(29/07/2025 00:00),TCB: Quyết định của HĐQT miễn nhiệm ông Phùng Quang Hưng - Phó Tổng Giám đốc thường trực từ 1.8.2025,https://cafef.vn/du-lieu/TCB-2265062/tcb-quyet-dinh-cua-hdqt-mien-nhiem-ong-phung-quang-hung-pho-tong-giam-doc-thuong-truc-tu-182025.chn?utm_source=du-lieu
83,(29/07/2025 00:00),TCB: Quyết định của HĐQT về việc thay đổi địa điểm PGD Lê Thánh Tông và PGD Thống Nhất,https://cafef.vn/du-lieu/TCB-2271739/tcb-quyet-dinh-cua-hdqt-ve-viec-thay-doi-dia-diem-pgd-le-thanh-tong-va-pgd-thong-nhat.chn?utm_source=du-lieu
84,(29/07/2025 00:00),TCB: Báo cáo tình hình quản trị công ty 06 tháng đầu năm 2025,https://cafef.vn/du-lieu/TCB-2271751/tcb-bao-cao-tinh-hinh-quan-tri-cong-ty-06-thang-dau-nam-2025.chn?utm_source=du-lieu
85,(24/07/2025 00:00),TCB: Quyết định của HĐQT về việc thay đổi địa điểm và đổi tên phòng GD Tây Hồ Tây,https://cafef.vn/du-lieu/TCB-2255848/tcb-quyet-dinh-cua-hdqt-ve-viec-thay-doi-dia-diem-va-doi-ten-phong-gd-tay-ho-tay.chn?utm_source=du-lieu
86,(22/07/2025 01:00),"Techcombank báo lãi trước thuế quý 2/2025 gần 7.900 tỷ đồng, cao nhất từ trước đến nay",https://cafef.vn/techcombank-bao-lai-truoc-thue-quy-22025-gan-7900-ty-dong-cao-nhat-tu-truoc-den-nay-188250722005155495.chn?utm_source=du-lieu
87,(22/07/2025 00:00),TCB: Nghị quyết HĐQT về việc phê duyệt phi tín dụng cho công ty con,https://cafef.vn/du-lieu/TCB-2253407/tcb-nghi-quyet-hdqt-ve-viec-phe-duyet-phi-tin-dung-cho-cong-ty-con.chn?utm_source=du-lieu
88,(22/07/2025 00:00),TCB: Thông báo thành lập CTCP Bảo hiểm Nhân thọ Kỹ thương,https://cafef.vn/du-lieu/TCB-2253408/tcb-thong-bao-thanh-lap-ctcp-bao-hiem-nhan-tho-ky-thuong.chn?utm_source=du-lieu
89,(17/07/2025 00:00),TCB: Thông báo thay đổi địa điểm Phòng giao dịch An Phú,https://cafef.vn/du-lieu/TCB-2248222/tcb-thong-bao-thay-doi-dia-diem-phong-giao-dich-an-phu.chn?utm_source=du-lieu
90,(15/07/2025 09:35),Sếp Dragon Capital 'chọn hàng' những DN được giao phó sứ mệnh quốc gia,https://cafef.vn/sep-dragon-capital-chon-hang-nhung-dn-duoc-giao-pho-su-menh-quoc-gia-188250715093532568.chn?utm_source=du-lieu
91,(15/07/2025 00:00),TCB: Em rể ông Hoàng Huy Trung - Trưởng BKS đăng ký mua 30.348 cp,https://cafef.vn/du-lieu/TCB-2246297/tcb-em-re-ong-hoang-huy-trung-truong-bks-dang-ky-mua-30348-cp.chn?utm_source=du-lieu
92,(15/07/2025 00:00),TCB: Bà Nguyễn Thị Trà My - Kế toán trưởng đăng ký mua 21.008 cp,https://cafef.vn/du-lieu/TCB-2246302/tcb-ba-nguyen-thi-tra-my-ke-toan-truong-dang-ky-mua-21008-cp.chn?utm_source=du-lieu
93,(15/07/2025 00:00),TCB: Bà Nguyễn Thu Lan - Phó Chủ tịch HĐQT đăng ký mua 362.023 cp,https://cafef.vn/du-lieu/TCB-2246306/tcb-ba-nguyen-thu-lan-pho-chu-tich-hdqt-dang-ky-mua-362023-cp.chn?utm_source=du-lieu
94,(15/07/2025 00:00),TCB: Ông Nguyễn Tuấn Minh - Phụ trách quản trị đăng ký mua 152.987 cp,https://cafef.vn/du-lieu/TCB-2246308/tcb-ong-nguyen-tuan-minh-phu-trach-quan-tri-dang-ky-mua-152987-cp.chn?utm_source=du-lieu
95,(15/07/2025 00:00),TCB: Ông Phạm Quang Thắng - Phó Tổng GĐ đăng ký mua 387.239 cp,https://cafef.vn/du-lieu/TCB-2246314/tcb-ong-pham-quang-thang-pho-tong-gd-dang-ky-mua-387239-cp.chn?utm_source=du-lieu
96,(15/07/2025 00:00),TCB: Ông Phùng Quang Hưng - Phó Tổng GĐ thường trực đăng ký mua 975.540 cp,https://cafef.vn/du-lieu/TCB-2246323/tcb-ong-phung-quang-hung-pho-tong-gd-thuong-truc-dang-ky-mua-975540-cp.chn?utm_source=du-lieu
97,(15/07/2025 00:00),TCB: Ông Alexandre Charles Emmanuel Macaire - Giám đốc Tài chính đăng ký mua 682.109 cp,https://cafef.vn/du-lieu/TCB-2246355/tcb-ong-alexandre-charles-emmanuel-macaire-giam-doc-tai-chinh-dang-ky-mua-682109-cp.chn?utm_source=du-lieu
98,(14/07/2025 00:00),"TCB: Quyết định của HĐQT về việc thay đổi địa chỉ trụ sở chính, các Chi nhánh và các Phòng GD trực thuộc tại TP. Hà Nội",https://cafef.vn/du-lieu/TCB-2245635/tcb-quyet-dinh-cua-hdqt-ve-viec-thay-doi-dia-chi-tru-so-chinh-cac-chi-nhanh-va-cac-phong-gd-truc-thuoc-tai-tp-ha-noi.chn?utm_source=du-lieu
99,(14/07/2025 00:00),TCB: Ông Phạm Quang Thắng - Phó Tổng GĐ đã bán 400.000 cp,https://cafef.vn/du-lieu/TCB-2245644/tcb-ong-pham-quang-thang-pho-tong-gd-da-ban-400000-cp.chn?utm_source=du-lieu
