,Thời gian,Tiêu đề,URL
292,(21/10/2024 16:32),"Techcombank lãi trước thuế 22,8 nghìn tỷ đồng trong 9 tháng đầu năm 2024, số dư CASA lập kỷ lục mới",https://cafef.vn/techcombank-lai-truoc-thue-228-nghin-ty-dong-trong-9-thang-dau-nam-2024-so-du-casa-lap-ky-luc-moi-188241021163208261.chn?utm_source=du-lieu
293,(21/10/2024 00:00),TCB: Nghị quyết HĐQT về việc cấp thẻ hạn mức tín dụng cho người có liên quan của Trưởng BKS,https://cafef.vn/du-lieu/TCB-2072565/tcb-nghi-quyet-hdqt-ve-viec-cap-the-han-muc-tin-dung-cho-nguoi-co-lien-quan-cua-truong-bks.chn?utm_source=du-lieu
294,(09/10/2024 00:00),TCB: Quyết định của HĐQT về việc thay đổi chi nhánh quản lý PGD Green Park,https://cafef.vn/du-lieu/TCB-2066681/tcb-quyet-dinh-cua-hdqt-ve-viec-thay-doi-chi-nhanh-quan-ly-pgd-green-park.chn?utm_source=du-lieu
295,(09/10/2024 00:00),TCB: Quyết định của HĐQT về việc thay đổi chi nhánh quản lý PGD Trần Quốc Hoàn,https://cafef.vn/du-lieu/TCB-2066684/tcb-quyet-dinh-cua-hdqt-ve-viec-thay-doi-chi-nhanh-quan-ly-pgd-tran-quoc-hoan.chn?utm_source=du-lieu
296,(09/10/2024 00:00),TCB: Nghị quyết HĐQT từ số 0708 đến số 0724 về giao dịch TCB với NCLQ của CĐL và NNB của TCB,https://cafef.vn/du-lieu/TCB-2066698/tcb-nghi-quyet-hdqt-tu-so-0708-den-so-0724-ve-giao-dich-tcb-voi-nclq-cua-cdl-va-nnb-cua-tcb.chn?utm_source=du-lieu
297,(08/10/2024 00:00),TCB: CBTT cập nhật về quan hệ đối tác độc quyền giữa Manulife Việt Nam và TCB,https://cafef.vn/du-lieu/TCB-2065747/tcb-cbtt-cap-nhat-ve-quan-he-doi-tac-doc-quyen-giua-manulife-viet-nam-va-tcb.chn?utm_source=du-lieu
298,(08/10/2024 00:00),TCB: Ông Phan Thanh Sơn - Phó Tổng GĐ đã bán 400.000 cp,https://cafef.vn/du-lieu/TCB-2065769/tcb-ong-phan-thanh-son-pho-tong-gd-da-ban-400000-cp.chn?utm_source=du-lieu
299,(08/10/2024 00:00),TCB: Nghị quyết HĐQT phê duyệt giao dịch/hợp đồng về cung cấp các dịch vụ liên quan đến phát hành riêng lẻ trái phiếu lần 15 năm 2024,https://cafef.vn/du-lieu/TCB-2065824/tcb-nghi-quyet-hdqt-phe-duyet-giao-dichhop-dong-ve-cung-cap-cac-dich-vu-lien-quan-den-phat-hanh-rieng-le-trai-phieu-lan-15-nam-2024.chn?utm_source=du-lieu
300,(07/10/2024 20:39),Cập nhật về quan hệ đối tác độc quyền giữa Manulife Việt Nam và Techcombank,https://cafef.vn/cap-nhat-ve-quan-he-doi-tac-doc-quyen-giua-manulife-viet-nam-va-techcombank-188241007201851211.chn?utm_source=du-lieu
301,(07/10/2024 00:00),TCB: Quyết định của HĐQT về việc thay đổi địa chỉ nhưng không phát sinh thay đổi địa điểm của Chi nhánh Nam Định,https://cafef.vn/du-lieu/TCB-2064989/tcb-quyet-dinh-cua-hdqt-ve-viec-thay-doi-dia-chi-nhung-khong-phat-sinh-thay-doi-dia-diem-cua-chi-nhanh-nam-dinh.chn?utm_source=du-lieu
302,(01/10/2024 00:00),TCB: Nghị quyết HĐQT về việc cấp hạn mức thẻ tín dụng cho thành viên HĐQT là người có liên quan,https://cafef.vn/du-lieu/TCB-2061996/tcb-nghi-quyet-hdqt-ve-viec-cap-han-muc-the-tin-dung-cho-thanh-vien-hdqt-la-nguoi-co-lien-quan.chn?utm_source=du-lieu
303,(27/09/2024 00:00),TCB: Nghị quyết HĐQT về việc TCBS tư vấn phát hành trái phiếu lần 14,https://cafef.vn/du-lieu/TCB-2060317/tcb-nghi-quyet-hdqt-ve-viec-tcbs-tu-van-phat-hanh-trai-phieu-lan-14.chn?utm_source=du-lieu
304,(27/09/2024 00:00),TCB: Nghị quyết HĐQT số 0684 ngày 27/09/2024,https://cafef.vn/du-lieu/TCB-2060371/tcb-nghi-quyet-hdqt-so-0684-ngay-27092024.chn?utm_source=du-lieu
305,(26/09/2024 00:00),TCB: Nghị quyết HĐQT phê duyệt giao dịch/ hợp đồng về cung cấp các dịch vụ liên quan đến phát hành riêng lẻ trái phiếu TCB năm 2024 - lần 11,https://cafef.vn/du-lieu/TCB-2059718/tcb-nghi-quyet-hdqt-phe-duyet-giao-dich-hop-dong-ve-cung-cap-cac-dich-vu-lien-quan-den-phat-hanh-rieng-le-trai-phieu-tcb-nam-2024-lan-11.chn?utm_source=du-lieu
306,(26/09/2024 00:00),TCB: Nghị quyết HĐQT phê duyệt giao dịch/ hợp đồng về cung cấp các dịch vụ liên quan đến phát hành riêng lẻ trái phiếu TCB năm 2024 - lần 12,https://cafef.vn/du-lieu/TCB-2059719/tcb-nghi-quyet-hdqt-phe-duyet-giao-dich-hop-dong-ve-cung-cap-cac-dich-vu-lien-quan-den-phat-hanh-rieng-le-trai-phieu-tcb-nam-2024-lan-12.chn?utm_source=du-lieu
307,(26/09/2024 00:00),TCB: Nghị quyết HĐQT phê duyệt giao dịch/ hợp đồng về cung cấp các dịch vụ liên quan đến phát hành riêng lẻ trái phiếu TCB năm 2024 - lần 13,https://cafef.vn/du-lieu/TCB-2059720/tcb-nghi-quyet-hdqt-phe-duyet-giao-dich-hop-dong-ve-cung-cap-cac-dich-vu-lien-quan-den-phat-hanh-rieng-le-trai-phieu-tcb-nam-2024-lan-13.chn?utm_source=du-lieu
308,(26/09/2024 00:00),TCB: Nghị quyết HĐQT phê duyệt giao dịch/ hợp đồng về cung cấp các dịch vụ liên quan đến phát hành riêng lẻ trái phiếu TCB năm 2024 - lần 10,https://cafef.vn/du-lieu/TCB-2059721/tcb-nghi-quyet-hdqt-phe-duyet-giao-dich-hop-dong-ve-cung-cap-cac-dich-vu-lien-quan-den-phat-hanh-rieng-le-trai-phieu-tcb-nam-2024-lan-10.chn?utm_source=du-lieu
309,(20/09/2024 00:00),TCB: Nghị quyết HĐQT về việc cấp hạn mức thẻ tín dụng cho người liên quan,https://cafef.vn/du-lieu/TCB-2056817/tcb-nghi-quyet-hdqt-ve-viec-cap-han-muc-the-tin-dung-cho-nguoi-lien-quan.chn?utm_source=du-lieu
310,(16/09/2024 00:00),TCB: Nghị quyết HĐQT về việc phê duyệt giao dịch giữa TCB và TCBS,https://cafef.vn/du-lieu/TCB-2054427/tcb-nghi-quyet-hdqt-ve-viec-phe-duyet-giao-dich-giua-tcb-va-tcbs.chn?utm_source=du-lieu
311,(10/09/2024 00:00),TCB: Nghị quyết HĐQT về việc cấp hạn mức tín dụng cho CTCP Eurowindow,https://cafef.vn/du-lieu/TCB-2051681/tcb-nghi-quyet-hdqt-ve-viec-cap-han-muc-tin-dung-cho-ctcp-eurowindow.chn?utm_source=du-lieu
312,(10/09/2024 00:00),TCB: Quyết định của HĐQT về việc thay đổi địa điểm Phòng giao dịch Cantavil An Phú,https://cafef.vn/du-lieu/TCB-2051719/tcb-quyet-dinh-cua-hdqt-ve-viec-thay-doi-dia-diem-phong-giao-dich-cantavil-an-phu.chn?utm_source=du-lieu
313,(10/09/2024 00:00),TCB: Quyết định của HĐQT về việc thay đổi địa điểm Phòng giao dịch Văn Lâm,https://cafef.vn/du-lieu/TCB-2051720/tcb-quyet-dinh-cua-hdqt-ve-viec-thay-doi-dia-diem-phong-giao-dich-van-lam.chn?utm_source=du-lieu
314,(10/09/2024 00:00),TCB: Ông Phan Thanh Sơn - Phó Tổng GĐ đăng ký bán 400.000 cp,https://cafef.vn/du-lieu/TCB-2051833/tcb-ong-phan-thanh-son-pho-tong-gd-dang-ky-ban-400000-cp.chn?utm_source=du-lieu
315,(05/09/2024 00:00),TCB: Nghị quyết HĐQT về việc cấp hạn mức tín dụng cho OMD,https://cafef.vn/du-lieu/TCB-2050529/tcb-nghi-quyet-hdqt-ve-viec-cap-han-muc-tin-dung-cho-omd.chn?utm_source=du-lieu
316,(30/08/2024 10:28),"Công bố Top 20 ngân hàng nộp ngân sách lớn nhất thuộc danh sách VNTAX 200: Gồm cả khối nhà nước, tư nhân, nước ngoài",https://cafef.vn/cong-bo-top-20-ngan-hang-nop-ngan-sach-lon-nhat-thuoc-danh-sach-vntax-200-gom-ca-khoi-nha-nuoc-tu-nhan-nuoc-ngoai-188240830102146924.chn?utm_source=du-lieu
317,(29/08/2024 15:30),Khách hàng hào hứng với Tuần lễ sinh lời tự động của Techcombank,https://cafef.vn/khach-hang-hao-hung-voi-tuan-le-sinh-loi-tu-dong-cua-techcombank-188240829122943715.chn?utm_source=du-lieu
318,(14/08/2024 00:00),TCB: Quyết định của HĐQT về việc thay đổi địa điểm Chi nhánh Hà Nội,https://cafef.vn/du-lieu/TCB-2038601/tcb-quyet-dinh-cua-hdqt-ve-viec-thay-doi-dia-diem-chi-nhanh-ha-noi.chn?utm_source=du-lieu
319,(14/08/2024 00:00),TCB: Nghị quyết HĐQT về việc triển khai phương án tăng vốn điều lệ 2024,https://cafef.vn/du-lieu/TCB-2039548/tcb-nghi-quyet-hdqt-ve-viec-trien-khai-phuong-an-tang-von-dieu-le-2024.chn?utm_source=du-lieu
320,(14/08/2024 00:00),TCB: Nghị quyết HĐQT về việc điều chỉnh tỷ lệ sở hữu của NĐTNN,https://cafef.vn/du-lieu/TCB-2039560/tcb-nghi-quyet-hdqt-ve-viec-dieu-chinh-ty-le-so-huu-cua-ndtnn.chn?utm_source=du-lieu
321,(13/08/2024 11:00),FiinRatings nâng hạng tín nhiệm Techcombank nhờ khả năng huy động vốn và thanh khoản,https://cafef.vn/fiinratings-nang-hang-tin-nhiem-techcombank-nho-kha-nang-huy-dong-von-va-thanh-khoan-188240813100240488.chn?utm_source=du-lieu
322,(09/08/2024 00:00),TCB: Ông Phan Thanh Sơn - Phó Tổng GĐ đã bán 300.000 cp,https://cafef.vn/du-lieu/TCB-2037462/tcb-ong-phan-thanh-son-pho-tong-gd-da-ban-300000-cp.chn?utm_source=du-lieu
323,(07/08/2024 00:00),TCB: Nghị quyết và Biên bản kiểm phiếu ĐHĐCĐ lấy ý kiến cổ đông bằng văn bản,https://cafef.vn/du-lieu/TCB-2035722/tcb-nghi-quyet-va-bien-ban-kiem-phieu-dhdcd-lay-y-kien-co-dong-bang-van-ban.chn?utm_source=du-lieu
324,(02/08/2024 10:30),"DN của 6 tỷ phú đô la Việt Nam nộp ngân sách gần 73.000 tỷ đồng năm 2023, gần bằng “người khổng lồ” PVN, ngang ngửa Viettel và Petrolimex cộng lại",https://cafef.vn/dn-cua-6-ty-phu-do-la-viet-nam-nop-ngan-sach-gan-73000-ty-dong-nam-2023-gan-bang-nguoi-khong-lo-pvn-ngang-ngua-viettel-va-petrolimex-cong-lai-188240801175416164.chn?utm_source=du-lieu
325,(31/07/2024 22:35),13 tổ chức và cá nhân nắm giữ cổ phiếu trên 1% tại Techcombank,https://cafef.vn/13-to-chuc-va-ca-nhan-nam-giu-co-phieu-tren-1-tai-techcombank-188240731223802744.chn?utm_source=du-lieu
326,(30/07/2024 00:00),TCB: Báo cáo tình hình quản trị công ty 6 tháng đầu năm 2024,https://cafef.vn/du-lieu/TCB-2032063/tcb-bao-cao-tinh-hinh-quan-tri-cong-ty-6-thang-dau-nam-2024.chn?utm_source=du-lieu
327,(29/07/2024 00:00),TCB: Tài liệu lấy ý kiến cổ đông bằng văn bản,https://cafef.vn/du-lieu/TCB-2030660/tcb-tai-lieu-lay-y-kien-co-dong-bang-van-ban.chn?utm_source=du-lieu
328,(26/07/2024 00:00),"TCB: 6.8.2024, giao dịch 3.522.510.811 cp niêm yết bổ sung",https://cafef.vn/du-lieu/TCB-2029614/tcb-682024-giao-dich-3522510811-cp-niem-yet-bo-sung.chn?utm_source=du-lieu
329,(26/07/2024 00:00),TCB: Quyết định của HĐQT về việc ban hành Điều lệ sửa đổi lần 3 (kèm Điều lệ),https://cafef.vn/du-lieu/TCB-2030040/tcb-quyet-dinh-cua-hdqt-ve-viec-ban-hanh-dieu-le-sua-doi-lan-3-kem-dieu-le.chn?utm_source=du-lieu
330,(25/07/2024 00:00),TCB: Quyết định của NHNNVN về việc sửa đổi nội dung vốn điều lệ tại Giấy phép hoạt động của TCB,https://cafef.vn/du-lieu/TCB-2028955/tcb-quyet-dinh-cua-nhnnvn-ve-viec-sua-doi-noi-dung-von-dieu-le-tai-giay-phep-hoat-dong-cua-tcb.chn?utm_source=du-lieu
331,(23/07/2024 00:00),TCB: Ông Phan Thanh Sơn - Phó Tổng GĐ đăng ký bán 300.000 cp,https://cafef.vn/du-lieu/TCB-2027889/tcb-ong-phan-thanh-son-pho-tong-gd-dang-ky-ban-300000-cp.chn?utm_source=du-lieu
332,(23/07/2024 00:00),"TCB: 24.7.2024, niêm yết bổ sung 3.522.510.811 cp",https://cafef.vn/du-lieu/TCB-2334847/tcb-2472024-niem-yet-bo-sung-3522510811-cp.chn?utm_source=du-lieu
333,(22/07/2024 12:30),"Techcombank báo lãi 15,6 nghìn tỷ đồng trong 6 tháng đầu năm, số dư CASA cao kỷ lục",https://cafef.vn/techcombank-bao-lai-156-nghin-ty-dong-trong-6-thang-dau-nam-so-du-casa-cao-ky-luc-188240722123038731.chn?utm_source=du-lieu
334,(19/07/2024 00:00),TCB: Nghị quyết HĐQT ký kết thỏa thuận hợp tác chiến lược giữa TCB và bên có liên quan,https://cafef.vn/du-lieu/TCB-2025733/tcb-nghi-quyet-hdqt-ky-ket-thoa-thuan-hop-tac-chien-luoc-giua-tcb-va-ben-co-lien-quan.chn?utm_source=du-lieu
335,(19/07/2024 00:00),TCB: Nghị quyết HĐQT giao dịch cấp hạn mức tín dụng cho Công ty Núi Pháo và Vonfram,https://cafef.vn/du-lieu/TCB-2027086/tcb-nghi-quyet-hdqt-giao-dich-cap-han-muc-tin-dung-cho-cong-ty-nui-phao-va-vonfram.chn?utm_source=du-lieu
336,(17/07/2024 00:00),TCB: Nghị quyết HĐQT cấp hạn mức thẻ tín dụng cho người nội bộ TCB,https://cafef.vn/du-lieu/TCB-2024851/tcb-nghi-quyet-hdqt-cap-han-muc-the-tin-dung-cho-nguoi-noi-bo-tcb.chn?utm_source=du-lieu
337,(17/07/2024 00:00),TCB: Ông Phan Thanh Sơn - Phó Tổng GĐ đã bán 100.000 cp,https://cafef.vn/du-lieu/TCB-2025042/tcb-ong-phan-thanh-son-pho-tong-gd-da-ban-100000-cp.chn?utm_source=du-lieu
338,(16/07/2024 00:00),TCB: Nghị quyết HĐQT về việc phê duyệt cấp HMTD cho NCLQ,https://cafef.vn/du-lieu/TCB-2024693/tcb-nghi-quyet-hdqt-ve-viec-phe-duyet-cap-hmtd-cho-nclq.chn?utm_source=du-lieu
339,(15/07/2024 15:30),"Techcombank ưu đãi lớn cho doanh nghiệp mua bán ngoại tệ, thanh toán quốc tế",https://cafef.vn/techcombank-uu-dai-lon-cho-doanh-nghiep-mua-ban-ngoai-te-thanh-toan-quoc-te-188240715114446968.chn?utm_source=du-lieu
340,(12/07/2024 00:00),"TCB: 16.7.2024, ngày GDKHQ lấy ý kiến cổ đông bằng văn bản lần 2 năm 2024",https://cafef.vn/du-lieu/TCB-2022029/tcb-1672024-ngay-gdkhq-lay-y-kien-co-dong-bang-van-ban-lan-2-nam-2024.chn?utm_source=du-lieu
341,(08/07/2024 00:00),TCB: Thông báo ngày ĐKCC lấy ý kiến cổ đông bằng văn bản,https://cafef.vn/du-lieu/TCB-2019909/tcb-thong-bao-ngay-dkcc-lay-y-kien-co-dong-bang-van-ban.chn?utm_source=du-lieu
342,(08/07/2024 00:00),TCB: Nghị quyết HĐQT về việc chốt danh sách cổ đông để lấy ý kiến cổ đông bằng văn bản,https://cafef.vn/du-lieu/TCB-2019910/tcb-nghi-quyet-hdqt-ve-viec-chot-danh-sach-co-dong-de-lay-y-kien-co-dong-bang-van-ban.chn?utm_source=du-lieu
343,(02/07/2024 13:30),TikTok SMB Summit 2024: Techcombank công bố gói tiện ích dành riêng cho nhà bán hàng online,https://cafef.vn/tiktok-smb-summit-2024-techcombank-cong-bo-goi-tien-ich-danh-rieng-cho-nha-ban-hang-online-188240702132359654.chn?utm_source=du-lieu
344,(02/07/2024 00:00),TCB: Nghị quyết HĐQT về việc phê duyệt cấp HMTD cho NNB và NCLQ,https://cafef.vn/du-lieu/TCB-2017147/tcb-nghi-quyet-hdqt-ve-viec-phe-duyet-cap-hmtd-cho-nnb-va-nclq.chn?utm_source=du-lieu
345,(28/06/2024 18:32),Bước đột phá mới ở Techcombank,https://cafef.vn/buoc-dot-pha-moi-o-techcombank-188240628183340072.chn?utm_source=du-lieu
346,(28/06/2024 00:00),TCB: Nghị quyết HĐQT phê duyệt giao dịch/hợp đồng về cung cấp các dịch vụ liên quan đến phát hành riêng lẻ trái phiếu lần 9 năm 2024,https://cafef.vn/du-lieu/TCB-2015920/tcb-nghi-quyet-hdqt-phe-duyet-giao-dichhop-dong-ve-cung-cap-cac-dich-vu-lien-quan-den-phat-hanh-rieng-le-trai-phieu-lan-9-nam-2024.chn?utm_source=du-lieu
347,(28/06/2024 00:00),TCB: Nghị quyết HĐQT về việc cấp hạn mức tín dụng cho NLQ của TCBS,https://cafef.vn/du-lieu/TCB-2016581/tcb-nghi-quyet-hdqt-ve-viec-cap-han-muc-tin-dung-cho-nlq-cua-tcbs.chn?utm_source=du-lieu
348,(27/06/2024 20:44),"Vốn điều lệ Techcombank vượt Vietcombank, VietinBank và BIDV",https://cafef.vn/von-dieu-le-techcombank-vuot-vietcombank-vietinbank-va-bidv-188240627204702845.chn?utm_source=du-lieu
349,(27/06/2024 00:00),TCB: Số lượng cổ phiếu có quyền biểu quyết đang lưu hành là 7.045.021.622 cp,https://cafef.vn/du-lieu/TCB-2015957/tcb-so-luong-co-phieu-co-quyen-bieu-quyet-dang-luu-hanh-la-7045021622-cp.chn?utm_source=du-lieu
350,(26/06/2024 00:00),TCB: Thông báo ký hợp đồng kiểm toán BCTC 2024,https://cafef.vn/du-lieu/TCB-2014271/tcb-thong-bao-ky-hop-dong-kiem-toan-bctc-2024.chn?utm_source=du-lieu
351,(26/06/2024 00:00),TCB: Nghị quyết HĐQT về việc TCBS tư vấn phát hành trái phiếu lần 7 năm 2024,https://cafef.vn/du-lieu/TCB-2014323/tcb-nghi-quyet-hdqt-ve-viec-tcbs-tu-van-phat-hanh-trai-phieu-lan-7-nam-2024.chn?utm_source=du-lieu
352,(26/06/2024 00:00),TCB: Nghị quyết HĐQT thông qua giao dịch với bên có liên quan TCBS,https://cafef.vn/du-lieu/TCB-2014333/tcb-nghi-quyet-hdqt-thong-qua-giao-dich-voi-ben-co-lien-quan-tcbs.chn?utm_source=du-lieu
353,(24/06/2024 20:30),Sapo và Techcombank hợp tác chiến lược nâng tầm giải pháp tài chính số,https://cafef.vn/sapo-va-techcombank-hop-tac-chien-luoc-nang-tam-giai-phap-tai-chinh-so-188240624201756074.chn?utm_source=du-lieu
354,(24/06/2024 00:00),TCB: Nghị quyết HĐQT phê duyệt giao dịch/hợp đồng về cung cấp các dịch vụ liên quan đến phát hành riêng lẻ trái phiếu lần 6 năm 2024,https://cafef.vn/du-lieu/TCB-2013017/tcb-nghi-quyet-hdqt-phe-duyet-giao-dichhop-dong-ve-cung-cap-cac-dich-vu-lien-quan-den-phat-hanh-rieng-le-trai-phieu-lan-6-nam-2024.chn?utm_source=du-lieu
355,(24/06/2024 00:00),TCB: Nghị quyết HĐQT về việc ký phụ lục hợp đồng với OMG,https://cafef.vn/du-lieu/TCB-2013018/tcb-nghi-quyet-hdqt-ve-viec-ky-phu-luc-hop-dong-voi-omg.chn?utm_source=du-lieu
356,(18/06/2024 00:00),TCB: Ông Phan Thanh Sơn - Phó Tổng GĐ đăng ký bán 100.000 cp,https://cafef.vn/du-lieu/TCB-2009975/tcb-ong-phan-thanh-son-pho-tong-gd-dang-ky-ban-100000-cp.chn?utm_source=du-lieu
357,(17/06/2024 00:00),"TCB: Nghị quyết HĐQT về việc ký hợp đồng chia sẻ dữ liệu giữa TCB với TCC, AMC",https://cafef.vn/du-lieu/TCB-2008855/tcb-nghi-quyet-hdqt-ve-viec-ky-hop-dong-chia-se-du-lieu-giua-tcb-voi-tcc-amc.chn?utm_source=du-lieu
358,(17/06/2024 00:00),TCB: Nghị quyết HĐQT số 0436 ngày 17/06/2024,https://cafef.vn/du-lieu/TCB-2009288/tcb-nghi-quyet-hdqt-so-0436-ngay-17062024.chn?utm_source=du-lieu
359,(13/06/2024 08:00),Cơ hội nào sinh lời cho những khoản tiền nằm chờ thời cơ đầu tư?,https://cafef.vn/co-hoi-nao-sinh-loi-cho-nhung-khoan-tien-nam-cho-thoi-co-dau-tu-18824061216003436.chn?utm_source=du-lieu
360,(13/06/2024 00:00),"TCB: 20.6.2024, ngày GDKHQ thưởng cp (tỷ lệ 1:1)",https://cafef.vn/du-lieu/TCB-2007079/tcb-2062024-ngay-gdkhq-thuong-cp-ty-le-11.chn?utm_source=du-lieu
361,(11/06/2024 00:00),TCB: Thông báo phát hành cổ phiếu để tăng vốn cổ phần từ nguồn vốn chủ sở hữu,https://cafef.vn/du-lieu/TCB-2005898/tcb-thong-bao-phat-hanh-co-phieu-de-tang-von-co-phan-tu-nguon-von-chu-so-huu.chn?utm_source=du-lieu
362,(10/06/2024 20:07),Techcombank chốt danh sách cổ đông ngày 21/6 thưởng cổ phiếu tỷ lệ 100%,https://cafef.vn/techcombank-chot-danh-sach-co-dong-ngay-216-thuong-co-phieu-ty-le-100-188240610200715961.chn?utm_source=du-lieu
363,(10/06/2024 08:39),Techcombank hoàn tất thủ tục cho kế hoạch tăng vốn ‘khủng’,https://cafef.vn/techcombank-hoan-tat-thu-tuc-cho-ke-hoach-tang-von-khung-188240610055015921.chn?utm_source=du-lieu
364,(10/06/2024 00:00),TCB: Nghị quyết HĐQT về việc ngày ĐKCC chốt danh sách phát hành cổ phiếu,https://cafef.vn/du-lieu/TCB-2005688/tcb-nghi-quyet-hdqt-ve-viec-ngay-dkcc-chot-danh-sach-phat-hanh-co-phieu.chn?utm_source=du-lieu
365,(10/06/2024 00:00),TCB: Nghị quyết HĐQT về việc TCBS tư vấn phát hành trái phiếu lần 5 năm 2024,https://cafef.vn/du-lieu/TCB-2005689/tcb-nghi-quyet-hdqt-ve-viec-tcbs-tu-van-phat-hanh-trai-phieu-lan-5-nam-2024.chn?utm_source=du-lieu
366,(07/06/2024 16:48),Cổ đông Techcombank nhận tin vui liên tiếp,https://cafef.vn/co-dong-techcombank-nhan-tin-vui-lien-tiep-188240607164841953.chn?utm_source=du-lieu
367,(07/06/2024 00:00),TCB: Thông báo công văn của UBCKNN về tài liệu báo cáo phát hành cổ phiếu để tăng vốn cổ phần từ NVCSH của TCB,https://cafef.vn/du-lieu/TCB-2004426/tcb-thong-bao-cong-van-cua-ubcknn-ve-tai-lieu-bao-cao-phat-hanh-co-phieu-de-tang-von-co-phan-tu-nvcsh-cua-tcb.chn?utm_source=du-lieu
368,(07/06/2024 00:00),TCB: Quyết định của HĐQT về việc thay đổi tên Phòng GD Big C,https://cafef.vn/du-lieu/TCB-2004428/tcb-quyet-dinh-cua-hdqt-ve-viec-thay-doi-ten-phong-gd-big-c.chn?utm_source=du-lieu
369,(07/06/2024 00:00),TCB: Quyết định của HĐQT về việc thay đổi địa điểm và đổi tên gọi phòng GD Trung Hòa,https://cafef.vn/du-lieu/TCB-2004429/tcb-quyet-dinh-cua-hdqt-ve-viec-thay-doi-dia-diem-va-doi-ten-goi-phong-gd-trung-hoa.chn?utm_source=du-lieu
370,(07/06/2024 00:00),TCB: Nghị quyết HĐQT về việc cấp hạn mức PSE cho TCBS,https://cafef.vn/du-lieu/TCB-2004431/tcb-nghi-quyet-hdqt-ve-viec-cap-han-muc-pse-cho-tcbs.chn?utm_source=du-lieu
371,(07/06/2024 00:00),TCB: Nghị quyết HĐQT về việc cấp hạn mức cho Công ty TNHH Khai thác CBKS Núi Pháo,https://cafef.vn/du-lieu/TCB-2004432/tcb-nghi-quyet-hdqt-ve-viec-cap-han-muc-cho-cong-ty-tnhh-khai-thac-cbks-nui-phao.chn?utm_source=du-lieu
372,(07/06/2024 00:00),TCB: Nghị quyết HĐQT về việc phê duyệt cấp hạn mức cho Vonfram Masan,https://cafef.vn/du-lieu/TCB-2004434/tcb-nghi-quyet-hdqt-ve-viec-phe-duyet-cap-han-muc-cho-vonfram-masan.chn?utm_source=du-lieu
373,(07/06/2024 00:00),TCB: Quyết định của HĐQT về việc thay đổi địa điểm và Chi nhánh quản lý của Phòng GD Lumiere,https://cafef.vn/du-lieu/TCB-2004479/tcb-quyet-dinh-cua-hdqt-ve-viec-thay-doi-dia-diem-va-chi-nhanh-quan-ly-cua-phong-gd-lumiere.chn?utm_source=du-lieu
374,(31/05/2024 09:00),Quản lý tài chính cá nhân: Làm gì để tiền không “ngủ”,https://cafef.vn/quan-ly-tai-chinh-ca-nhan-lam-gi-de-tien-khong-ngu-188240531083159831.chn?utm_source=du-lieu
375,(30/05/2024 08:00),Cơ hội và thách thức cho doanh nghiệp dệt may 2024,https://cafef.vn/co-hoi-va-thach-thuc-cho-doanh-nghiep-det-may-2024-188240529164723338.chn?utm_source=du-lieu
376,(27/05/2024 00:00),TCB: Nghị quyết HĐQT thông qua hợp đồng phát hành trái phiếu với bên có liên quan TCBS,https://cafef.vn/du-lieu/TCB-1998147/tcb-nghi-quyet-hdqt-thong-qua-hop-dong-phat-hanh-trai-phieu-voi-ben-co-lien-quan-tcbs.chn?utm_source=du-lieu
377,(27/05/2024 00:00),TCB: Nghị quyết HĐQT về cấp bảo lãnh cho WinEco,https://cafef.vn/du-lieu/TCB-1998159/tcb-nghi-quyet-hdqt-ve-cap-bao-lanh-cho-wineco.chn?utm_source=du-lieu
378,(24/05/2024 00:00),TCB: Nghị quyết HĐQT số 0363 ngày 23/05/2024,https://cafef.vn/du-lieu/TCB-1997308/tcb-nghi-quyet-hdqt-so-0363-ngay-23052024.chn?utm_source=du-lieu
379,(23/05/2024 07:33),"Bí mật ít người biết về câu chuyện ""Sinh lời tự động"" tại Techcombank",https://cafef.vn/bi-mat-it-nguoi-biet-ve-cau-chuyen-sinh-loi-tu-dong-tai-techcombank-188240522222603478.chn?utm_source=du-lieu
380,(21/05/2024 13:21),"Ba cái “nhất” trong Quý 1/2024, tạo đà bứt phá cho Techcombank",https://cafef.vn/ba-cai-nhat-trong-quy-12024-tao-da-but-pha-cho-techcombank-188240521124811633.chn?utm_source=du-lieu
381,(21/05/2024 00:00),TCB: Công đoàn TCB đăng ký đã chuyển quyền sở hữu 488.080 cp,https://cafef.vn/du-lieu/TCB-1995799/tcb-cong-doan-tcb-dang-ky-da-chuyen-quyen-so-huu-488080-cp.chn?utm_source=du-lieu
382,(16/05/2024 08:00),"Muôn vàn lợi thế khi doanh nghiệp sở hữu tài khoản số đẹp, không chỉ để dễ nhớ",https://cafef.vn/muon-van-loi-the-khi-doanh-nghiep-so-huu-tai-khoan-so-dep-khong-chi-de-de-nho-188240516070713705.chn?utm_source=du-lieu
383,(16/05/2024 00:00),TCB: Quyết định của HĐQT về việc thay đổi địa chỉ Phòng giao dịch Mỹ Phước,https://cafef.vn/du-lieu/TCB-1993299/tcb-quyet-dinh-cua-hdqt-ve-viec-thay-doi-dia-chi-phong-giao-dich-my-phuoc.chn?utm_source=du-lieu
384,(13/05/2024 00:00),TCB: Quyết định của HĐQT về việc ban hành Điều lệ (kèm Điều lệ),https://cafef.vn/du-lieu/TCB-1991534/tcb-quyet-dinh-cua-hdqt-ve-viec-ban-hanh-dieu-le-kem-dieu-le.chn?utm_source=du-lieu
385,(13/05/2024 00:00),TCB: Nghị quyết HĐQT số 0333 ngày 10/05/2024,https://cafef.vn/du-lieu/TCB-1991545/tcb-nghi-quyet-hdqt-so-0333-ngay-10052024.chn?utm_source=du-lieu
386,(13/05/2024 00:00),TCB: Nghị quyết HĐQT số 0334 ngày 10/05/2024,https://cafef.vn/du-lieu/TCB-1991546/tcb-nghi-quyet-hdqt-so-0334-ngay-10052024.chn?utm_source=du-lieu
387,(13/05/2024 00:00),TCB: Nghị quyết HĐQT số 0332 ngày 10/05/2024,https://cafef.vn/du-lieu/TCB-1991547/tcb-nghi-quyet-hdqt-so-0332-ngay-10052024.chn?utm_source=du-lieu
388,(13/05/2024 00:00),TCB: Nghị quyết HĐQT số 0330 ngày 10/05/2024,https://cafef.vn/du-lieu/TCB-1991548/tcb-nghi-quyet-hdqt-so-0330-ngay-10052024.chn?utm_source=du-lieu
389,(13/05/2024 00:00),TCB: Nghị quyết HĐQT số 0331 ngày 10/05/2024,https://cafef.vn/du-lieu/TCB-1991550/tcb-nghi-quyet-hdqt-so-0331-ngay-10052024.chn?utm_source=du-lieu
390,(13/05/2024 00:00),TCB: Nghị quyết HĐQT số 0328 ngày 10/05/2024,https://cafef.vn/du-lieu/TCB-1991552/tcb-nghi-quyet-hdqt-so-0328-ngay-10052024.chn?utm_source=du-lieu
391,(13/05/2024 00:00),TCB: Nghị quyết HĐQT số 0329 ngày 10/05/2024,https://cafef.vn/du-lieu/TCB-1991553/tcb-nghi-quyet-hdqt-so-0329-ngay-10052024.chn?utm_source=du-lieu
392,(13/05/2024 00:00),TCB: Nghị quyết HĐQT số 0327 ngày 10/05/2024,https://cafef.vn/du-lieu/TCB-1991554/tcb-nghi-quyet-hdqt-so-0327-ngay-10052024.chn?utm_source=du-lieu
393,(13/05/2024 00:00),TCB: Nghị quyết HĐQT số 0325 ngày 10/05/2024,https://cafef.vn/du-lieu/TCB-1991555/tcb-nghi-quyet-hdqt-so-0325-ngay-10052024.chn?utm_source=du-lieu
394,(13/05/2024 00:00),TCB: Nghị quyết HĐQT số 0326 ngày 10/05/2024,https://cafef.vn/du-lieu/TCB-1991556/tcb-nghi-quyet-hdqt-so-0326-ngay-10052024.chn?utm_source=du-lieu
395,(13/05/2024 00:00),TCB: Nghị quyết HĐQT số 0324 ngày 10/05/2024,https://cafef.vn/du-lieu/TCB-1991557/tcb-nghi-quyet-hdqt-so-0324-ngay-10052024.chn?utm_source=du-lieu
396,(13/05/2024 00:00),TCB: Nghị quyết HĐQT số 0323 ngày 10/05/2024,https://cafef.vn/du-lieu/TCB-1991560/tcb-nghi-quyet-hdqt-so-0323-ngay-10052024.chn?utm_source=du-lieu
