,Thời gian,Tiêu đề,URL
100,(10/07/2025 14:47),Techcombank Investment Summit 2025: “Việt Nam mới: Tầm nhìn kiến tạo giá trị”,https://cafef.vn/techcombank-investment-summit-2025-viet-nam-moi-tam-nhin-kien-tao-gia-tri-188250710144712965.chn?utm_source=du-lieu
101,(09/07/2025 00:00),TCB: Thông báo phát hành cổ phiếu theo chương trình ESOP,https://cafef.vn/du-lieu/TCB-2241250/tcb-thong-bao-phat-hanh-co-phieu-theo-chuong-trinh-esop.chn?utm_source=du-lieu
102,(09/07/2025 00:00),TCB: Thông báo phát hành cổ phiếu theo chương trình ESOP,https://cafef.vn/du-lieu/TCB-2244171/tcb-thong-bao-phat-hanh-co-phieu-theo-chuong-trinh-esop.chn?utm_source=du-lieu
103,(04/07/2025 00:00),TCB: Quyết định của HĐQT về việc thay đổi địa điểm Chi nhánh Hải Phòng,https://cafef.vn/du-lieu/TCB-2239616/tcb-quyet-dinh-cua-hdqt-ve-viec-thay-doi-dia-diem-chi-nhanh-hai-phong.chn?utm_source=du-lieu
104,(04/07/2025 00:00),"TCB: Quyết định của HĐQT về việc thay đổi địa chỉ Chi nhánh, Phòng GD nhưng không phát sinh thay đổi địa điểm",https://cafef.vn/du-lieu/TCB-2239617/tcb-quyet-dinh-cua-hdqt-ve-viec-thay-doi-dia-chi-chi-nhanh-phong-gd-nhung-khong-phat-sinh-thay-doi-dia-diem.chn?utm_source=du-lieu
105,(02/07/2025 07:03),"Cuộc đua vốn hóa 25 năm: Một công ty thủy điện từng giữ ngôi vua trước khi những 'gã khổng lồ' FPT, Vinamilk, Vietcombank 'tràn' lên sàn",https://cafef.vn/cuoc-dua-von-hoa-25-nam-mot-cong-ty-thuy-dien-tung-giu-ngoi-vua-truoc-khi-nhung-ga-khong-lo-fpt-vinamilk-vietcombank-tran-len-san-188250702070405395.chn?utm_source=du-lieu
106,(02/07/2025 00:00),TCB: Ủy quyền cho ông Phạm Quang Thắng công bố thông tin từ 1.7.2025,https://cafef.vn/du-lieu/TCB-2236871/tcb-uy-quyen-cho-ong-pham-quang-thang-cong-bo-thong-tin-tu-172025.chn?utm_source=du-lieu
107,(02/07/2025 00:00),TCB: Giấy ủy quyền thực hiện công bố thông tin,https://cafef.vn/du-lieu/TCB-2236875/tcb-giay-uy-quyen-thuc-hien-cong-bo-thong-tin.chn?utm_source=du-lieu
108,(01/07/2025 00:00),TCB: Thông báo về hồ sơ thay đổi tỷ lệ sở hữu nước ngoài tối đa,https://cafef.vn/du-lieu/TCB-2235971/tcb-thong-bao-ve-ho-so-thay-doi-ty-le-so-huu-nuoc-ngoai-toi-da.chn?utm_source=du-lieu
109,(30/06/2025 00:00),"Vốn hóa HoSE tăng 690.000 tỷ đồng trong nửa năm: Tỷ phú Phạm Nhật Vượng chiếm 80%, TCB và Gelex góp trên 1 tỷ USD; FPT, VCB giảm mạnh nhất",https://cafef.vn/von-hoa-hose-tang-690000-ty-dong-trong-nua-nam-ty-phu-pham-nhat-vuong-chiem-80-tcb-va-gelex-gop-tren-1-ty-usd-fpt-vcb-giam-manh-nhat-188250629231048618.chn?utm_source=du-lieu
110,(27/06/2025 11:20),"Lần đầu tiên trong lịch sử, các DN của 6 tỷ phú đô la Việt Nam nộp ngân sách lên tới 112.000 tỷ đồng, vượt xa ông lớn nhà nước PVN",https://cafef.vn/lan-dau-tien-trong-lich-su-cac-dn-cua-6-ty-phu-do-la-viet-nam-nop-ngan-sach-len-toi-112000-ty-dong-vuot-xa-ong-lon-nha-nuoc-pvn-188250627111731718.chn?utm_source=du-lieu
111,(27/06/2025 00:12),CTCK dự báo lợi nhuận loạt ngân hàng lớn,https://cafef.vn/ctck-du-bao-loi-nhuan-loat-ngan-hang-lon-188250626234831135.chn?utm_source=du-lieu
112,(26/06/2025 22:43),Techcombank miễn nhiệm Phó tổng giám đốc Phan Thanh Sơn,https://cafef.vn/techcombank-mien-nhiem-pho-tong-giam-doc-phan-thanh-son-188250626224319638.chn?utm_source=du-lieu
113,(26/06/2025 00:00),TCB: Quyết định của HĐQT về việc miễn nhiệm ông Phan Thanh Sơn - Phó Tổng Giám đốc từ 26.6.2025,https://cafef.vn/du-lieu/TCB-2231635/tcb-quyet-dinh-cua-hdqt-ve-viec-mien-nhiem-ong-phan-thanh-son-pho-tong-giam-doc-tu-2662025.chn?utm_source=du-lieu
114,(25/06/2025 00:00),TCB: Thông báo về việc ký hợp đồng kiểm toán BCTC năm 2025,https://cafef.vn/du-lieu/TCB-2230608/tcb-thong-bao-ve-viec-ky-hop-dong-kiem-toan-bctc-nam-2025.chn?utm_source=du-lieu
115,(25/06/2025 00:00),TCB: Nghị quyết HĐQT phê duyệt giao dịch/ hợp đồng cung cấp dịch vụ đại lý lưu ký cho Trái phiếu TCB phát hành riêng lẻ 2025 - lần 16,https://cafef.vn/du-lieu/TCB-2230649/tcb-nghi-quyet-hdqt-phe-duyet-giao-dich-hop-dong-cung-cap-dich-vu-dai-ly-luu-ky-cho-trai-phieu-tcb-phat-hanh-rieng-le-2025-lan-16.chn?utm_source=du-lieu
116,(24/06/2025 00:00),TCB: Ông Phạm Quang Thắng - Phó Tổng GĐ đăng ký bán 400.000 cp,https://cafef.vn/du-lieu/TCB-2229708/tcb-ong-pham-quang-thang-pho-tong-gd-dang-ky-ban-400000-cp.chn?utm_source=du-lieu
117,(23/06/2025 00:00),TCB: Quyết định của HĐQT về việc thay đổi địa điểm Chi nhánh Hải Dương,https://cafef.vn/du-lieu/TCB-2228175/tcb-quyet-dinh-cua-hdqt-ve-viec-thay-doi-dia-diem-chi-nhanh-hai-duong.chn?utm_source=du-lieu
118,(20/06/2025 00:00),TCB: Quyết định của HĐQT về việc điều chỉnh tên phường tại địa điểm đặt trụ sở của Phòng Giao dịch Đống Đa,https://cafef.vn/du-lieu/TCB-2227966/tcb-quyet-dinh-cua-hdqt-ve-viec-dieu-chinh-ten-phuong-tai-dia-diem-dat-tru-so-cua-phong-giao-dich-dong-da.chn?utm_source=du-lieu
119,(19/06/2025 11:08),"CTCK dự báo lợi nhuận quý 2 của 11 ngân hàng: Sacombank, VietinBank, MB, VPBank, BIDV có thể tăng trưởng 2 chữ số",https://cafef.vn/ctck-du-bao-loi-nhuan-quy-2-cua-11-ngan-hang-sacombank-vietinbank-mb-vpbank-bidv-co-the-tang-truong-2-chu-so-188250619105742072.chn?utm_source=du-lieu
120,(16/06/2025 00:00),TCB: Nghị quyết HĐQT về việc cấp hạn mức tín dụng cho NLQ tại TechAMC,https://cafef.vn/du-lieu/TCB-2223100/tcb-nghi-quyet-hdqt-ve-viec-cap-han-muc-tin-dung-cho-nlq-tai-techamc.chn?utm_source=du-lieu
121,(16/06/2025 00:00),TCB: Nghị quyết HĐQT về việc cấp hạn mức thẻ tín dụng cho NLQ của Thành viên HĐQT,https://cafef.vn/du-lieu/TCB-2223108/tcb-nghi-quyet-hdqt-ve-viec-cap-han-muc-the-tin-dung-cho-nlq-cua-thanh-vien-hdqt.chn?utm_source=du-lieu
122,(13/06/2025 00:00),TCB: Nghị quyết HĐQT số 0369 ngày 12/06/2025,https://cafef.vn/du-lieu/TCB-2221231/tcb-nghi-quyet-hdqt-so-0369-ngay-12062025.chn?utm_source=du-lieu
123,(13/06/2025 00:00),TCB: Nghị quyết HĐQT phê duyệt giao dịch giữa TCB và TCBS,https://cafef.vn/du-lieu/TCB-2221232/tcb-nghi-quyet-hdqt-phe-duyet-giao-dich-giua-tcb-va-tcbs.chn?utm_source=du-lieu
124,(12/06/2025 10:33),Techcombank và hành trình “Sinh Lời Tự Động”: Khi tiền không chỉ nằm yên trong tài khoản,https://cafef.vn/techcombank-va-hanh-trinh-sinh-loi-tu-dong-khi-tien-khong-chi-nam-yen-trong-tai-khoan-188250612101202188.chn?utm_source=du-lieu
125,(11/06/2025 09:25),Con trai Chủ tịch Hồ Hùng Anh 'lộ diện' tại một doanh nghiệp liên quan đến công nghệ,https://cafef.vn/con-trai-chu-tich-ho-hung-anh-lo-dien-tai-mot-doanh-nghiep-lien-quan-den-cong-nghe-18825061108333655.chn?utm_source=du-lieu
126,(11/06/2025 00:00),TCB: Quyết định của HĐQT về việc ban hành điều lệ sửa đổi lần 3 năm 2025,https://cafef.vn/du-lieu/TCB-2219468/tcb-quyet-dinh-cua-hdqt-ve-viec-ban-hanh-dieu-le-sua-doi-lan-3-nam-2025.chn?utm_source=du-lieu
127,(06/06/2025 00:00),TCB: Thông báo nghĩa vụ nộp thuế,https://cafef.vn/du-lieu/TCB-2215878/tcb-thong-bao-nghia-vu-nop-thue.chn?utm_source=du-lieu
128,(06/06/2025 00:00),TCB: Nghị quyết HĐQT v/v ký hợp đồng với người có liên quan - Công ty Cổ phần One Mount Group,https://cafef.vn/du-lieu/TCB-2215969/tcb-nghi-quyet-hdqt-vv-ky-hop-dong-voi-nguoi-co-lien-quan-cong-ty-co-phan-one-mount-group.chn?utm_source=du-lieu
129,(05/06/2025 00:00),TCB: Nghị quyết HĐQT về việc TCBS tư vấn phát hành trái phiếu lần 11.2025,https://cafef.vn/du-lieu/TCB-2214887/tcb-nghi-quyet-hdqt-ve-viec-tcbs-tu-van-phat-hanh-trai-phieu-lan-112025.chn?utm_source=du-lieu
130,(05/06/2025 00:00),TCB: Nghị quyết HĐQT về việc TCBS tư vấn phát hành trái phiếu lần 12.2025,https://cafef.vn/du-lieu/TCB-2214888/tcb-nghi-quyet-hdqt-ve-viec-tcbs-tu-van-phat-hanh-trai-phieu-lan-122025.chn?utm_source=du-lieu
131,(05/06/2025 00:00),TCB: Nghị quyết HĐQT về việc TCBS tư vấn phát hành trái phiếu lần 13.2025,https://cafef.vn/du-lieu/TCB-2214889/tcb-nghi-quyet-hdqt-ve-viec-tcbs-tu-van-phat-hanh-trai-phieu-lan-132025.chn?utm_source=du-lieu
132,(04/06/2025 00:00),"TCB: Quyết định về việc sửa đổi, bổ sung nội dung Giấy phép thành lập và hoạt động",https://cafef.vn/du-lieu/TCB-2214098/tcb-quyet-dinh-ve-viec-sua-doi-bo-sung-noi-dung-giay-phep-thanh-lap-va-hoat-dong.chn?utm_source=du-lieu
133,(03/06/2025 13:57),Campaign Asia: Giám đốc Khối Tiếp thị Techcombank năm thứ 2 liên tiếp TOP 50 nhà tiếp thị ảnh hưởng nhất khu vực Châu Á - Thái Bình Dương,https://cafef.vn/campaign-asia-giam-doc-khoi-tiep-thi-techcombank-nam-thu-2-lien-tiep-top-50-nha-tiep-thi-anh-huong-nhat-khu-vuc-chau-a-thai-binh-duong-188250603135732989.chn?utm_source=du-lieu
134,(30/05/2025 19:37),"Techcombank khai phóng sức mạnh chuyển đổi số, giới thiệu giải pháp đột phá tại sự kiện Chuyển đổi số ngành ngân hàng 2025",https://cafef.vn/techcombank-khai-phong-suc-manh-chuyen-doi-so-gioi-thieu-giai-phap-dot-pha-tai-su-kien-chuyen-doi-so-nganh-ngan-hang-2025-188250530193803043.chn?utm_source=du-lieu
135,(30/05/2025 10:51),Anh tài Tiến Đạt và hành trình 10 năm rẽ hướng kinh doanh: Từ suy nghĩ “mua một bán hai là lời rồi” cho đến bước ngoặt về tư duy quản lý dòng tiền nhàn rỗi,https://cafef.vn/anh-tai-tien-dat-va-hanh-trinh-10-nam-re-huong-kinh-doanh-tu-suy-nghi-mua-mot-ban-hai-la-loi-roi-cho-den-buoc-ngoat-ve-tu-duy-quan-ly-dong-tien-nhan-roi-188250529131921811.chn?utm_source=du-lieu
136,(28/05/2025 00:00),TCB: Nghị quyết HĐQT về việc TCBS tư vấn phát hành Trái phiếu TCB lần 8/2025,https://cafef.vn/du-lieu/TCB-2207930/tcb-nghi-quyet-hdqt-ve-viec-tcbs-tu-van-phat-hanh-trai-phieu-tcb-lan-82025.chn?utm_source=du-lieu
137,(28/05/2025 00:00),TCB: Nghị quyết HĐQT về việc TCBS tư vấn phát hành Trái phiếu TCB lần 9/2025,https://cafef.vn/du-lieu/TCB-2207931/tcb-nghi-quyet-hdqt-ve-viec-tcbs-tu-van-phat-hanh-trai-phieu-tcb-lan-92025.chn?utm_source=du-lieu
138,(28/05/2025 00:00),TCB: Nghị quyết HĐQT về việc TCBS tư vấn phát hành Trái phiếu TCB lần 10/2025,https://cafef.vn/du-lieu/TCB-2207932/tcb-nghi-quyet-hdqt-ve-viec-tcbs-tu-van-phat-hanh-trai-phieu-tcb-lan-102025.chn?utm_source=du-lieu
139,(28/05/2025 00:00),TCB: Quyết định của HĐQT về việc thay đổi địa điểm Chi nhánh Hưng Yên,https://cafef.vn/du-lieu/TCB-2207940/tcb-quyet-dinh-cua-hdqt-ve-viec-thay-doi-dia-diem-chi-nhanh-hung-yen.chn?utm_source=du-lieu
140,(27/05/2025 10:15),"Techcombank 3 năm liên tiếp thắng lớn tại lễ trao giải The Asian Banker, khẳng định vị thế ngân hàng giao dịch hàng đầu khu vực",https://cafef.vn/techcombank-3-nam-lien-tiep-thang-lon-tai-le-trao-giai-the-asian-banker-khang-dinh-vi-the-ngan-hang-giao-dich-hang-dau-khu-vuc-188250527101556047.chn?utm_source=du-lieu
141,(23/05/2025 14:54),"Tiền thông minh, view bùng nổ: Huy NL chia sẻ bí quyết dẫn đầu xu hướng",https://cafef.vn/tien-thong-minh-view-bung-no-huy-nl-chia-se-bi-quyet-dan-dau-xu-huong-188250523143235602.chn?utm_source=du-lieu
142,(21/05/2025 00:00),TCB: Quyết định của HĐQT về việc thay đổi địa điểm Phòng giao dịch Lê Đức Thọ,https://cafef.vn/du-lieu/TCB-2204219/tcb-quyet-dinh-cua-hdqt-ve-viec-thay-doi-dia-diem-phong-giao-dich-le-duc-tho.chn?utm_source=du-lieu
143,(20/05/2025 00:00),TCB: Quyết định của HĐQT về việc thay đổi địa điểm Phòng giao dịch Đống Đa,https://cafef.vn/du-lieu/TCB-2203545/tcb-quyet-dinh-cua-hdqt-ve-viec-thay-doi-dia-diem-phong-giao-dich-dong-da.chn?utm_source=du-lieu
144,(19/05/2025 00:03),"Lần đầu tiên trong lịch sử TTCK Việt Nam, có 2 gen Z sở hữu khối tài sản 10.000 tỷ, sắp vào top 10 người giàu nhất",https://cafef.vn/lan-dau-tien-trong-lich-su-ttck-viet-nam-co-2-gen-z-so-huu-khoi-tai-san-10000-ty-sap-vao-top-10-nguoi-giau-nhat-188250518222929927.chn?utm_source=du-lieu
145,(19/05/2025 00:01),"“MAG-7 chứng khoán Việt Nam”: 4 ngân hàng và 3 cổ phiếu “họ” Vingroup, tổng vốn hóa gần 1,9 triệu tỷ đồng",https://cafef.vn/mag7-chung-khoan-viet-nam-4-ngan-hang-va-3-co-phieu-ho-vingroup-tong-von-hoa-gan-19-trieu-ty-dong-188250518223626178.chn?utm_source=du-lieu
146,(16/05/2025 18:37),"Chỉ ra ba rủi ro khi để dòng tiền bị “ngủ quên”, CEO Trương Lý Hoàng Phi tiết lộ bí quyết đầu tư hiệu quả ngay cả với những khoản tiền nhỏ",https://cafef.vn/chi-ra-ba-rui-ro-khi-de-dong-tien-bi-ngu-quen-ceo-truong-ly-hoang-phi-tiet-lo-bi-quyet-dau-tu-hieu-qua-ngay-ca-voi-nhung-khoan-tien-nho-188250516180606949.chn?utm_source=du-lieu
147,(14/05/2025 10:44),Ra mắt Techcombank Private Lounge - Phòng chờ sân bay đẳng cấp nâng tầm trải nghiệm cùng tinh hoa văn hoá,https://cafef.vn/ra-mat-techcombank-private-lounge-phong-cho-san-bay-dang-cap-nang-tam-trai-nghiem-cung-tinh-hoa-van-hoa-188250514104433961.chn?utm_source=du-lieu
148,(14/05/2025 00:00),TCB: Nghị quyết HĐQT về việc cấp hạn mức thẻ tín dụng cho Người có liên quan,https://cafef.vn/du-lieu/TCB-2197616/tcb-nghi-quyet-hdqt-ve-viec-cap-han-muc-the-tin-dung-cho-nguoi-co-lien-quan.chn?utm_source=du-lieu
149,(12/05/2025 15:17),Techcombank lập kỷ lục mới sau khi ông Hồ Hùng Anh nói về mục tiêu vốn hoá 20 tỷ USD,https://cafef.vn/techcombank-lap-ky-luc-moi-sau-khi-ong-ho-hung-anh-noi-ve-muc-tieu-von-hoa-20-ty-usd-188250512151752905.chn?utm_source=du-lieu
150,(12/05/2025 13:14),"Techcombank giành giải vàng Stevie Awards châu Á – Thái Bình Dương: Xây dựng thương hiệu từ nội lực, tạo dấu ấn khu vực và Quốc tế",https://cafef.vn/techcombank-gianh-giai-vang-stevie-awards-chau-a-thai-binh-duong-xay-dung-thuong-hieu-tu-noi-luc-tao-dau-an-khu-vuc-va-quoc-te-188250512131429468.chn?utm_source=du-lieu
151,(12/05/2025 11:05),TCB: Nghị quyết HĐQT về việc triển khai chi tiết Phương án tăng vốn điều lệ ESOP 2025,https://cafef.vn/du-lieu/TCB-2227469/tcb-nghi-quyet-hdqt-ve-viec-trien-khai-chi-tiet-phuong-an-tang-von-dieu-le-esop-2025.chn?utm_source=du-lieu
152,(12/05/2025 11:02),TCB: Nghị quyết HĐQT về việc điều chỉnh tỷ lệ SHNN,https://cafef.vn/du-lieu/TCB-2227468/tcb-nghi-quyet-hdqt-ve-viec-dieu-chinh-ty-le-shnn.chn?utm_source=du-lieu
153,(12/05/2025 00:00),TCB: Nghị quyết HĐQT về việc điều chỉnh tỷ lệ sở hữu nước ngoài,https://cafef.vn/du-lieu/TCB-2197486/tcb-nghi-quyet-hdqt-ve-viec-dieu-chinh-ty-le-so-huu-nuoc-ngoai.chn?utm_source=du-lieu
154,(12/05/2025 00:00),TCB: Nghị quyết HĐQT về việc triển khai chi tiết Phương án tăng vốn điều lệ ESOP 2025,https://cafef.vn/du-lieu/TCB-2197487/tcb-nghi-quyet-hdqt-ve-viec-trien-khai-chi-tiet-phuong-an-tang-von-dieu-le-esop-2025.chn?utm_source=du-lieu
155,(07/05/2025 14:44),Vì sao Techcombank tự tin Sinh Lời Tự Động là khác biệt và không có “nhưng”?,https://cafef.vn/vi-sao-techcombank-tu-tin-sinh-loi-tu-dong-la-khac-biet-va-khong-co-nhung-188250507144444248.chn?utm_source=du-lieu
156,(06/05/2025 00:00),TCB: Nghị quyết HĐQT về giao dịch ký Hợp đồng mua sim 4G Wintel của Công ty Cổ phần Mobicast,https://cafef.vn/du-lieu/TCB-2196495/tcb-nghi-quyet-hdqt-ve-giao-dich-ky-hop-dong-mua-sim-4g-wintel-cua-cong-ty-co-phan-mobicast.chn?utm_source=du-lieu
157,(06/05/2025 00:00),"TCB: Nghị quyết HĐQT thông qua Hợp đồng, giao dịch thuộc nghiệp vụ phi tín dụng với Công ty Cổ phần 1 Matrix",https://cafef.vn/du-lieu/TCB-2196496/tcb-nghi-quyet-hdqt-thong-qua-hop-dong-giao-dich-thuoc-nghiep-vu-phi-tin-dung-voi-cong-ty-co-phan-1-matrix.chn?utm_source=du-lieu
158,(03/05/2025 00:05),"Tỷ phú Nguyễn Thị Phương Thảo, Phạm Nhật Vượng, Hồ Hùng Anh: Ai có siêu kế hoạch tham vọng nhất Việt Nam?",https://cafef.vn/ty-phu-nguyen-thi-phuong-thao-pham-nhat-vuong-ho-hung-anh-ai-co-sieu-ke-hoach-tham-vong-nhat-viet-nam-188250502235607651.chn?utm_source=du-lieu
159,(29/04/2025 01:32),"Con trai tỷ phú Hồ Hùng Anh đã bắt tay cùng 1 “lão làng” lập công ty triển khai dự án mạng blockchain Việt Nam, ra mắt ngay đầu tháng 5",https://cafef.vn/con-trai-ty-phu-ho-hung-anh-da-bat-tay-cung-1-lao-lang-lap-cong-ty-trien-khai-du-an-mang-blockchain-viet-nam-ra-mat-ngay-dau-thang-5-188250429013226252.chn?utm_source=du-lieu
160,(29/04/2025 00:00),TCB: Quyết định của BKS về việc ban hành Quy chế hoạt động của BKS (đính kèm quy chế),https://cafef.vn/du-lieu/TCB-2195550/tcb-quyet-dinh-cua-bks-ve-viec-ban-hanh-quy-che-hoat-dong-cua-bks-dinh-kem-quy-che.chn?utm_source=du-lieu
161,(29/04/2025 00:00),TCB: Nghị quyết HĐQT về việc TCBS tư vấn phát hành trái phiếu lần 7 năm 2025,https://cafef.vn/du-lieu/TCB-2195761/tcb-nghi-quyet-hdqt-ve-viec-tcbs-tu-van-phat-hanh-trai-phieu-lan-7-nam-2025.chn?utm_source=du-lieu
162,(29/04/2025 00:00),TCB: Quyết định của HĐQT về việc công bố Điều lệ sửa đổi (kèm điều lệ),https://cafef.vn/du-lieu/TCB-2195790/tcb-quyet-dinh-cua-hdqt-ve-viec-cong-bo-dieu-le-sua-doi-kem-dieu-le.chn?utm_source=du-lieu
163,(29/04/2025 00:00),TCB: Quyết định của HĐQT về việc công bố Quy chế tổ chức và hoạt động của HĐQT,https://cafef.vn/du-lieu/TCB-2195791/tcb-quyet-dinh-cua-hdqt-ve-viec-cong-bo-quy-che-to-chuc-va-hoat-dong-cua-hdqt.chn?utm_source=du-lieu
164,(28/04/2025 00:00),TCB: Nghị quyết và Biên bản họp ĐHĐCĐ thường niên năm 2025,https://cafef.vn/du-lieu/TCB-2220614/tcb-nghi-quyet-va-bien-ban-hop-dhdcd-thuong-nien-nam-2025.chn?utm_source=du-lieu
165,(26/04/2025 20:08),"Tổng Giám đốc Techcombank: Các ngân hàng khác cũng có sinh lời tự động, nhưng chỉ giống chúng tôi ở cái tên",https://cafef.vn/tong-giam-doc-techcombank-cac-ngan-hang-khac-cung-co-sinh-loi-tu-dong-nhung-chi-giong-chung-toi-o-cai-ten-188250426200842358.chn?utm_source=du-lieu
166,(26/04/2025 11:35),"Chủ tịch Hồ Hùng Anh: Mục tiêu lớn nhất của Techcombank là đạt vốn hoá 20 tỷ USD vào cuối năm 2025, khi thời điểm đến, giá trị sẽ bùng nổ",https://cafef.vn/chu-tich-ho-hung-anh-muc-tieu-lon-nhat-cua-techcombank-la-dat-von-hoa-20-ty-usd-vao-cuoi-nam-2025-khi-thoi-diem-den-gia-tri-se-bung-no-188250426113635913.chn?utm_source=du-lieu
167,(25/04/2025 14:32),"Global Finance năm thứ 2 liên tiếp vinh danh Techcombank là ""Ngân hàng tốt nhất Việt Nam""",https://cafef.vn/global-finance-nam-thu-2-lien-tiep-vinh-danh-techcombank-la-ngan-hang-tot-nhat-viet-nam-188250425143306687.chn?utm_source=du-lieu
168,(25/04/2025 00:00),TCB: Nghị quyết HĐQT về việc bổ sung nội dung và tài liệu tại chương trình ĐHĐCĐ thường niên 2025,https://cafef.vn/du-lieu/TCB-2191112/tcb-nghi-quyet-hdqt-ve-viec-bo-sung-noi-dung-va-tai-lieu-tai-chuong-trinh-dhdcd-thuong-nien-2025.chn?utm_source=du-lieu
169,(23/04/2025 00:00),TCB: Nghị quyết HĐQT về việc TCBS tư vấn phát hành trái phiếu lần 6 năm 2025,https://cafef.vn/du-lieu/TCB-2186996/tcb-nghi-quyet-hdqt-ve-viec-tcbs-tu-van-phat-hanh-trai-phieu-lan-6-nam-2025.chn?utm_source=du-lieu
170,(23/04/2025 00:00),TCB: Nghị quyết HĐQT về việc TCBS tư vấn phát hành trái phiếu lần 5 năm 2025,https://cafef.vn/du-lieu/TCB-2186998/tcb-nghi-quyet-hdqt-ve-viec-tcbs-tu-van-phat-hanh-trai-phieu-lan-5-nam-2025.chn?utm_source=du-lieu
171,(23/04/2025 00:00),TCB: Nghị quyết HĐQT về việc cấp hạn mức thẻ tín dụng cho NCLQ của NNB,https://cafef.vn/du-lieu/TCB-2187000/tcb-nghi-quyet-hdqt-ve-viec-cap-han-muc-the-tin-dung-cho-nclq-cua-nnb.chn?utm_source=du-lieu
172,(22/04/2025 14:02),“Sinh Lời trúng lớn” cùng Techcombank với tổng giá trị giải thưởng đến 250 tỷ đồng,https://cafef.vn/sinh-loi-trung-lon-cung-techcombank-voi-tong-gia-tri-giai-thuong-den-250-ty-dong-188250422140253764.chn?utm_source=du-lieu
173,(22/04/2025 00:00),TCB: Nghị quyết HĐQT về việc cấp hạn mức thẻ tín dụng cho Người có liên quan của Người nội bộ,https://cafef.vn/du-lieu/TCB-2186035/tcb-nghi-quyet-hdqt-ve-viec-cap-han-muc-the-tin-dung-cho-nguoi-co-lien-quan-cua-nguoi-noi-bo.chn?utm_source=du-lieu
174,(21/04/2025 07:41),"Techcombank mang cả tinh hoa nước Pháp về Việt Nam, tôn vinh những di sản văn hóa độc bản",https://cafef.vn/techcombank-mang-ca-tinh-hoa-nuoc-phap-ve-viet-nam-ton-vinh-nhung-di-san-van-hoa-doc-ban-188250421074145517.chn?utm_source=du-lieu
175,(16/04/2025 00:00),TCB: Nghị quyết HĐQT về việc TCBS tư vấn phát hành trái phiếu lần 02 năm 2025,https://cafef.vn/du-lieu/TCB-2179789/tcb-nghi-quyet-hdqt-ve-viec-tcbs-tu-van-phat-hanh-trai-phieu-lan-02-nam-2025.chn?utm_source=du-lieu
176,(16/04/2025 00:00),TCB: Nghị quyết HĐQT về việc TCBS tư vấn phát hành trái phiếu lần 03 năm 2025,https://cafef.vn/du-lieu/TCB-2179790/tcb-nghi-quyet-hdqt-ve-viec-tcbs-tu-van-phat-hanh-trai-phieu-lan-03-nam-2025.chn?utm_source=du-lieu
177,(16/04/2025 00:00),TCB: Nghị quyết HĐQT về việc TCBS tư vấn phát hành trái phiếu lần 01 năm 2025,https://cafef.vn/du-lieu/TCB-2179794/tcb-nghi-quyet-hdqt-ve-viec-tcbs-tu-van-phat-hanh-trai-phieu-lan-01-nam-2025.chn?utm_source=du-lieu
178,(16/04/2025 00:00),TCB: Nghị quyết HĐQT về việc TCBS tư vấn phát hành trái phiếu lần 04 năm 2025,https://cafef.vn/du-lieu/TCB-2179795/tcb-nghi-quyet-hdqt-ve-viec-tcbs-tu-van-phat-hanh-trai-phieu-lan-04-nam-2025.chn?utm_source=du-lieu
179,(15/04/2025 16:30),Giải pháp nào cho doanh nghiệp đón xu hướng dịch chuyển chuỗi cung ứng toàn cầu?,https://cafef.vn/giai-phap-nao-cho-doanh-nghiep-don-xu-huong-dich-chuyen-chuoi-cung-ung-toan-cau-188250415153111279.chn?utm_source=du-lieu
180,(15/04/2025 00:00),TCB: Quyết định của HĐQT về việc thay đổi địa điểm và đổi tên chi nhánh Ecopark,https://cafef.vn/du-lieu/TCB-2179702/tcb-quyet-dinh-cua-hdqt-ve-viec-thay-doi-dia-diem-va-doi-ten-chi-nhanh-ecopark.chn?utm_source=du-lieu
181,(15/04/2025 00:00),TCB: Quyết định của HĐQT về việc thay đổi địa điểm Chi nhánh Bắc Giang,https://cafef.vn/du-lieu/TCB-2179703/tcb-quyet-dinh-cua-hdqt-ve-viec-thay-doi-dia-diem-chi-nhanh-bac-giang.chn?utm_source=du-lieu
182,(15/04/2025 00:00),TCB: Quyết định của HĐQT về việc thay đổi địa điểm và đổi tên Phòng GD Yên Mỹ,https://cafef.vn/du-lieu/TCB-2179704/tcb-quyet-dinh-cua-hdqt-ve-viec-thay-doi-dia-diem-va-doi-ten-phong-gd-yen-my.chn?utm_source=du-lieu
183,(15/04/2025 00:00),TCB: Quyết định của HĐQT về việc thay đổi địa điểm Chi nhánh Hải Phòng,https://cafef.vn/du-lieu/TCB-2179705/tcb-quyet-dinh-cua-hdqt-ve-viec-thay-doi-dia-diem-chi-nhanh-hai-phong.chn?utm_source=du-lieu
184,(10/04/2025 00:00),TCB: Nghị quyết HĐQT về việc phê duyệt giao dịch phi tín dụng với Ông Hồ Hùng Anh,https://cafef.vn/du-lieu/TCB-2170045/tcb-nghi-quyet-hdqt-ve-viec-phe-duyet-giao-dich-phi-tin-dung-voi-ong-ho-hung-anh.chn?utm_source=du-lieu
185,(10/04/2025 00:00),TCB: Nghị quyết HĐQT về việc phê duyệt giao dịch phi tín dụng với Bà Nguyễn Thu Lan,https://cafef.vn/du-lieu/TCB-2170046/tcb-nghi-quyet-hdqt-ve-viec-phe-duyet-giao-dich-phi-tin-dung-voi-ba-nguyen-thu-lan.chn?utm_source=du-lieu
186,(10/04/2025 00:00),TCB: Nghị quyết HĐQT về việc phê duyệt giao dịch phi tín dụng với Ông Nguyễn Cảnh Sơn,https://cafef.vn/du-lieu/TCB-2170047/tcb-nghi-quyet-hdqt-ve-viec-phe-duyet-giao-dich-phi-tin-dung-voi-ong-nguyen-canh-son.chn?utm_source=du-lieu
187,(10/04/2025 00:00),TCB: Nghị quyết HĐQT về việc phê duyệt giao dịch phi tín dụng với Ông Hồ Anh Ngọc,https://cafef.vn/du-lieu/TCB-2170048/tcb-nghi-quyet-hdqt-ve-viec-phe-duyet-giao-dich-phi-tin-dung-voi-ong-ho-anh-ngoc.chn?utm_source=du-lieu
188,(03/04/2025 13:22),Tổng giám đốc Techcombank Jens Lottner: Việt Nam có thể tận dụng những lợi thế để phát triển trung tâm tài chính,https://cafef.vn/tong-giam-doc-techcombank-jens-lottner-viet-nam-co-the-tan-dung-nhung-loi-the-de-phat-trien-trung-tam-tai-chinh-188250403132215213.chn?utm_source=du-lieu
189,(03/04/2025 10:18),"Techcombank đặt mục tiêu lợi nhuận 31.500 tỷ đồng trong năm 2025, muốn trở thành ngân hàng đầu tiên ứng dụng AI toàn diện ở Việt Nam",https://cafef.vn/techcombank-dat-muc-tieu-loi-nhuan-31500-ty-dong-trong-nam-2025-muon-tro-thanh-ngan-hang-dau-tien-ung-dung-ai-toan-dien-o-viet-nam-188250403101827111.chn?utm_source=du-lieu
190,(03/04/2025 00:00),TCB: Tài liệu họp ĐHĐCĐ thường niên năm 2025,https://cafef.vn/du-lieu/TCB-2165078/tcb-tai-lieu-hop-dhdcd-thuong-nien-nam-2025.chn?utm_source=du-lieu
191,(27/03/2025 00:00),TCB: Quyết định của HĐQT về việc thay đổi địa điểm Phòng giao dịch Dĩ An,https://cafef.vn/du-lieu/TCB-2159512/tcb-quyet-dinh-cua-hdqt-ve-viec-thay-doi-dia-diem-phong-giao-dich-di-an.chn?utm_source=du-lieu
192,(25/03/2025 00:00),TCB: Nghị quyết HĐQT về việc ký kết hợp đồng với OM cung cấp phần mềm,https://cafef.vn/du-lieu/TCB-2157617/tcb-nghi-quyet-hdqt-ve-viec-ky-ket-hop-dong-voi-om-cung-cap-phan-mem.chn?utm_source=du-lieu
